{"run":79,"commit":"abe969d","metric":9.011039,"metrics":{"tps":9.011039,"e2e_tps":1.284883,"spec_sec":24.905,"gen_tokens":32,"steps":16,"committed":33,"step_ms":221.95,"pack_ms":1.08,"draft_ms":149.2,"topk_ms":19.99,"exact_ms":51.65,"exact_decode_ms":0,"acceptance":2.062},"status":"discard","description":"test DDTree budget 24 after promising budget 26","timestamp":1777503455626,"segment":1,"confidence":12.590074250645914,"asi":{"hypothesis":"budget 24 may be the smallest budget that retains the 16-step acceptance gain while lowering overhead more than budget 26","rollback_reason":"budget 24 preserved 16 steps but step time regressed to 221.95 ms and TPS fell well below budget 26 and the kept best","next_action_hint":"budget 26 looks more promising than 24; repeat 26 or test 25/27 if continuing budget tuning"}}
{"run":80,"commit":"abe969d","metric":8.965795,"metrics":{"tps":8.965795,"e2e_tps":1.280974,"spec_sec":24.981,"gen_tokens":32,"steps":16,"committed":33,"step_ms":223.07,"pack_ms":1.07,"draft_ms":149.46,"topk_ms":20.71,"exact_ms":51.79,"exact_decode_ms":0,"acceptance":2.062},"status":"discard","description":"repeat DDTree budget 26 to check noise","timestamp":1777503555898,"segment":1,"confidence":10.891133809356086,"asi":{"hypothesis":"repeat budget 26 because the previous 9.50 TPS result may indicate a smaller-budget sweet spot or may be noise","rollback_reason":"repeat preserved 16-step acceptance but regressed to 8.97 TPS, confirming the earlier 9.50 budget-26 run was mostly noise","next_action_hint":"do not keep budget 26; budget 32 remains the configured best despite noisy single-run highs"}}
{"run":81,"commit":"a4884f4","metric":10.147906,"metrics":{"tps":10.147906,"e2e_tps":1.29749,"spec_sec":24.663,"gen_tokens":32,"steps":14,"committed":33,"step_ms":225.24,"pack_ms":1.12,"draft_ms":145.35,"topk_ms":20.04,"exact_ms":58.69,"exact_decode_ms":0,"acceptance":2.357},"status":"keep","description":"add proposal-temperature override and test budget 32 at temp 1.0","timestamp":1777503715337,"segment":1,"confidence":11.576312390556494,"asi":{"hypothesis":"greedy sampling uses --temp 0, but DDTree proposal scoring should not necessarily use near-zero temperature; a separate proposal temperature can allocate budget to useful alternatives while exact validation preserves bit-equal output","result":"LLAMA_DDTREE_PROPOSAL_TEMP=1.0 with budget 32 reduced steps from 16 to 14 and improved decode TPS to 10.15 despite higher exact cost per step","next_action_hint":"confirm on repeat and sweep proposal_temp around 0.5/0.75/1.25; if robust, consider making proposal temperature distinct from sampler temperature by default"}}
{"run":82,"commit":"f282526","metric":10.443251,"metrics":{"tps":10.443251,"e2e_tps":1.302932,"spec_sec":24.56,"gen_tokens":32,"steps":14,"committed":33,"step_ms":218.87,"pack_ms":1.11,"draft_ms":140.22,"topk_ms":19.49,"exact_ms":58.02,"exact_decode_ms":0,"acceptance":2.357},"status":"keep","description":"tune DDTree proposal temperature to 0.75","timestamp":1777503819076,"segment":1,"confidence":12.243787036262265,"asi":{"hypothesis":"proposal_temp=0.75 may keep the useful branch diversity from temp 1.0 while weighting top draft candidates more strongly, reducing per-step overhead or improving acceptance stability","result":"proposal_temp=0.75 matched the 14-step/2.36 acceptance gain and improved decode TPS to 10.44 via lower step time than temp 1.0","next_action_hint":"sweep 0.5 and 0.9/1.25, then repeat the best to check noise; validate on a second prompt before hardcoding any default"}}
{"run":83,"commit":"f282526","metric":9.354263,"metrics":{"tps":9.354263,"e2e_tps":1.28123,"spec_sec":24.976,"gen_tokens":32,"steps":15,"committed":34,"step_ms":228.06,"pack_ms":1.09,"draft_ms":149.88,"topk_ms":20.81,"exact_ms":56.24,"exact_decode_ms":0,"acceptance":2.267},"status":"discard","description":"sweep DDTree proposal temperature 0.5","timestamp":1777503920054,"segment":1,"confidence":12.281436942986181,"asi":{"hypothesis":"proposal_temp=0.5 may focus tree budget on higher-confidence draft branches and reduce wasted alternatives versus 0.75/1.0","rollback_reason":"0.5 reduced acceptance relative to 0.75 and needed 15 steps; step time also worsened, so primary TPS dropped below current best","next_action_hint":"proposal_temp around 0.75 remains best; test 0.9 or 0.625 next rather than going lower"}}
{"run":84,"commit":"f282526","metric":10.070113,"metrics":{"tps":10.070113,"e2e_tps":1.299229,"spec_sec":24.63,"gen_tokens":32,"steps":14,"committed":33,"step_ms":226.98,"pack_ms":1.12,"draft_ms":146.35,"topk_ms":20.69,"exact_ms":58.8,"exact_decode_ms":0,"acceptance":2.357},"status":"discard","description":"sweep DDTree proposal temperature 0.9","timestamp":1777504018992,"segment":1,"confidence":12.265451874159854,"asi":{"hypothesis":"proposal_temp=0.9 may keep the 14-step branch-diversity gain of 0.75/1.0 while being less noisy than 0.75","rollback_reason":"0.9 preserved 14 steps and 2.36 acceptance but step time was worse than 0.75, so primary TPS fell below current best","next_action_hint":"0.75 remains the best tested proposal temperature; try 0.625/0.8 or repeat 0.75 for stability"}}
{"run":85,"commit":"f282526","metric":9.341975,"metrics":{"tps":9.341975,"e2e_tps":1.288712,"spec_sec":24.831,"gen_tokens":32,"steps":15,"committed":34,"step_ms":228.36,"pack_ms":1.11,"draft_ms":149.89,"topk_ms":21.18,"exact_ms":56.13,"exact_decode_ms":0,"acceptance":2.267},"status":"discard","description":"sweep DDTree proposal temperature 0.625","timestamp":1777504113549,"segment":1,"confidence":12.249508362405432,"asi":{"hypothesis":"proposal_temp=0.625 may sit between 0.5 and 0.75, preserving more branch diversity than 0.5 while focusing proposals more than 0.75","rollback_reason":"0.625 behaved like 0.5: 15 steps, 2.27 acceptance, and slower step time; primary TPS well below 0.75","next_action_hint":"lower side of temp sweep is done; 0.75 remains best, test 0.8/0.7 or repeat 0.75"}}
{"run":86,"commit":"f282526","metric":9.949568,"metrics":{"tps":9.949568,"e2e_tps":1.292303,"spec_sec":24.762,"gen_tokens":32,"steps":14,"committed":33,"step_ms":229.73,"pack_ms":1.1,"draft_ms":148.29,"topk_ms":21.43,"exact_ms":58.88,"exact_decode_ms":0,"acceptance":2.357},"status":"discard","description":"sweep DDTree proposal temperature 0.8","timestamp":1777504213478,"segment":1,"confidence":12.153903309794075,"asi":{"hypothesis":"proposal_temp=0.8 may be close to the observed 0.75 optimum while possibly more robust than 0.75","rollback_reason":"0.8 kept the 14-step/2.36 acceptance pattern but step time and topk were worse, so primary TPS stayed below 0.75","next_action_hint":"0.75 remains the best tested proposal temperature; test 0.7 or repeat 0.75 for stability"}}
{"run":87,"commit":"c499e6d","metric":10.507099,"metrics":{"tps":10.507099,"e2e_tps":1.308686,"spec_sec":24.452,"gen_tokens":32,"steps":14,"committed":33,"step_ms":217.54,"pack_ms":1.11,"draft_ms":138.33,"topk_ms":19.95,"exact_ms":58.11,"exact_decode_ms":0,"acceptance":2.357},"status":"keep","description":"sweep DDTree proposal temperature 0.7","timestamp":1777504313200,"segment":1,"confidence":12.22183088063815,"asi":{"hypothesis":"proposal_temp=0.7 may be slightly better than 0.75 by keeping the same 14-step branch diversity while weighting top candidates a little more strongly","result":"0.7 preserved the 14-step/2.36 acceptance behavior and improved decode TPS to 10.51 with lower draft/step time than 0.75","next_action_hint":"repeat 0.7 and test 0.68/0.72; validate on additional prompt before making proposal_temp=0.7 a hard default"}}
{"run":88,"commit":"c499e6d","metric":10.013205,"metrics":{"tps":10.013205,"e2e_tps":1.300654,"spec_sec":24.603,"gen_tokens":32,"steps":14,"committed":32,"step_ms":228.27,"pack_ms":1.11,"draft_ms":149.75,"topk_ms":20.67,"exact_ms":56.7,"exact_decode_ms":0,"acceptance":2.286},"status":"discard","description":"sweep DDTree proposal temperature 0.68","timestamp":1777504416257,"segment":1,"confidence":12.743318525446139,"asi":{"hypothesis":"proposal_temp=0.68 may refine the 0.7 optimum by slightly increasing confidence weighting without falling into the 0.625/0.5 lower-acceptance regime","rollback_reason":"0.68 kept 14 steps but committed/acceptance fell and draft/step time worsened, so primary TPS dropped below 0.7","next_action_hint":"0.7 remains better than the lower side; test 0.72 or repeat 0.7 for noise"}}
{"run":89,"commit":"c499e6d","metric":10.111096,"metrics":{"tps":10.111096,"e2e_tps":1.280974,"spec_sec":24.981,"gen_tokens":32,"steps":14,"committed":33,"step_ms":226.06,"pack_ms":1.11,"draft_ms":144.8,"topk_ms":21.34,"exact_ms":58.76,"exact_decode_ms":0,"acceptance":2.357},"status":"discard","description":"sweep DDTree proposal temperature 0.72","timestamp":1777504517855,"segment":1,"confidence":12.766361853364844,"asi":{"hypothesis":"proposal_temp=0.72 may sit close to the 0.7 optimum while preserving 0.75-like acceptance stability","rollback_reason":"0.72 preserved 14 steps and 2.36 acceptance but topk/step time were worse than 0.7; primary TPS below best","next_action_hint":"proposal_temp 0.7 remains best; repeat 0.7 for confirmation or test nearby 0.69/0.71 only if needed"}}
{"run":90,"commit":"c499e6d","metric":9.937888,"metrics":{"tps":9.937888,"e2e_tps":1.292146,"spec_sec":24.765,"gen_tokens":32,"steps":14,"committed":33,"step_ms":230,"pack_ms":1.11,"draft_ms":149.15,"topk_ms":21.08,"exact_ms":58.63,"exact_decode_ms":0,"acceptance":2.357},"status":"discard","description":"repeat DDTree proposal temperature 0.7","timestamp":1777504613299,"segment":1,"confidence":12.802747380091832,"asi":{"hypothesis":"repeat proposal_temp=0.7 to check whether the 10.51 TPS run was stable or mostly noise","rollback_reason":"repeat preserved 14-step/2.36 acceptance but step time regressed to 230 ms, so primary TPS was below the kept best; structural gain is stable but single-run TPS is noisy","next_action_hint":"treat proposal_temp=0.7 as useful for fewer steps but compare future changes against a 9.9-10.5 TPS noise range"}}
{"run":91,"commit":"c499e6d","metric":3.149191,"metrics":{"tps":3.149191,"e2e_tps":1.013588,"spec_sec":31.571,"gen_tokens":32,"steps":14,"committed":33,"step_ms":725.81,"pack_ms":1.16,"draft_ms":149.93,"topk_ms":20.87,"exact_ms":59.92,"exact_decode_ms":0,"acceptance":2.357},"status":"discard","description":"diagnostic batched-vs-exact trace with proposal temp 0.7","timestamp":1777505377073,"segment":1,"confidence":12.319068657292135,"asi":{"hypothesis":"enable batched tree verify trace to measure batched posterior vs exact validation agreement and margin for possible high-confidence exact-skip rule","rollback_reason":"diagnostic trace adds target-tree/snapshot overhead, so primary TPS is expectedly worse and not a runtime optimization","result":"for visible traced tail, batched_exact_same=14 and diff=0 in stats; parsed 3 trace lines all had batched_commit_n equal exact commit_n with min margin 2.12, avg margin 7.62","next_action_hint":"improve trace capture to emit compact aggregate metrics for all steps instead of relying on tailed logs; this run suggests current prompt/temp0.7 has no batched/exact divergence, but broader prompts are needed before trusting batched"}}
{"run":92,"commit":"c499e6d","metric":3.209461,"metrics":{"tps":3.209461,"e2e_tps":1.019303,"spec_sec":31.394,"gen_tokens":32,"steps":14,"committed":33,"step_ms":712.18,"pack_ms":1.16,"draft_ms":152.9,"topk_ms":20.95,"exact_ms":0,"exact_decode_ms":0,"acceptance":2.357},"status":"discard","description":"fast-batched correctness probe at proposal temp 0.7","timestamp":1777505519305,"segment":1,"confidence":11.723331153709331,"asi":{"hypothesis":"if proposal_temp=0.7 eliminates batched/exact divergence on this prompt, fast-batched can skip exact validation and remain bit-equal, clarifying whether exact skip is correctness-safe before optimizing rollback","rollback_reason":"correctness passed, but snapshot+replay fast-batched path is far slower: step=712 ms due snapshot 177.6 ms, target_tree 118.6 ms, replay 53.2 ms; primary TPS much worse","result":"batched path produced bit-equal output with budget32/temp0.7 on this prompt; stats show committed=33, batched_committed=33, max_commit=4, no divergence in final token sequence","next_action_hint":"exact-skip is only useful if paired with no-snapshot fast rollback or another cheap state-commit path; next root-cause work should quantify/compress persist buffers or add aggregate batched/exact margin diagnostics across prompts"}}
{"run":93,"commit":"c499e6d","metric":0,"metrics":{"tps":0,"e2e_tps":0,"spec_sec":21.672,"gen_tokens":0,"steps":1,"committed":0,"step_ms":0,"pack_ms":3.69,"draft_ms":154.36,"topk_ms":14.63,"exact_ms":0,"exact_decode_ms":0,"acceptance":0},"status":"crash","description":"diagnose fast rollback persist memory split at budget 14","timestamp":1777505657370,"segment":1,"confidence":11.723331153709331,"asi":{"hypothesis":"quantify DFlash fast-rollback persist allocation into SSM vs conv components to see whether conv F32 is the main compressible memory target","rollback_reason":"diagnostic logging changed code and fast rollback still OOMed before generating tokens, so not a throughput improvement","result":"budget14 planned persist split: ssm=1008.00 MiB, conv=78.75 MiB, total=1086.75 MiB; CUDA allocation failed for the full 1086.75 MiB","next_action_hint":"conv F32 is only about 7.2% of budget14 persist; compressing conv alone cannot make fast rollback fit. The dominant target is SSM persist, already F16 on CUDA, or freeing/defragmenting ~1.1 GiB elsewhere"}}
{"run":94,"commit":"c499e6d","metric":0,"metrics":{"tps":0,"e2e_tps":0,"spec_sec":21.723,"gen_tokens":0,"steps":1,"committed":0,"step_ms":0,"pack_ms":3.53,"draft_ms":137.37,"topk_ms":13.7,"exact_ms":0,"exact_decode_ms":0,"acceptance":0},"status":"crash","description":"fast rollback fit probe with budget 8 persist","timestamp":1777505801493,"segment":1,"confidence":11.723331153709331,"asi":{"hypothesis":"using a much smaller budget 8 should reduce DFlash fast-rollback persist to about 621 MiB; if it fits, fast-batched plus rollback can reveal whether cheap state commit can offset lower acceptance","rollback_reason":"budget8 persist still OOMed before any token was generated, so no throughput result; snapshot fallback was disabled intentionally to test true fast rollback fit","result":"CUDA allocation failed for 621.00 MiB persist at n_tokens=8; even the small-budget fast rollback path cannot fit in the current 64k/full-target/full-draft memory envelope","next_action_hint":"fast rollback needs either freeing hundreds of MiB elsewhere before persist allocation or changing allocation strategy/lifetime; smaller budget alone is not enough, so investigate target/draft compute buffers or lower n_ctx/offload as controlled diagnostics"}}
{"run":95,"commit":"c499e6d","metric":8.005844,"metrics":{"tps":8.005844,"e2e_tps":1.269589,"spec_sec":25.205,"gen_tokens":32,"steps":18,"committed":33,"step_ms":222.06,"pack_ms":1.08,"draft_ms":132.93,"topk_ms":15.31,"exact_ms":0,"exact_decode_ms":0,"acceptance":1.833},"status":"discard","description":"fast rollback fit probe at 32k context with budget 8","timestamp":1777505918594,"segment":1,"confidence":11.195080202773184,"asi":{"hypothesis":"lowering n_ctx from 64k to 32k may free enough GPU memory for even budget8 fast rollback, revealing whether fast-batched plus cheap state commit can be viable when persist fits","rollback_reason":"32k/budget8 fast rollback fit and remained bit-equal, but acceptance fell to 1.83 over 18 steps and TPS stayed below the current exact-validation best","result":"persist allocated successfully: 621.00 MiB, fast_rollback=18, snapshot_replays=0, exact=0, target_tree=70.61 ms, rollback=0.65 ms, step=222.06 ms, correctness PASS","next_action_hint":"fast rollback itself is cheap when it fits; the remaining costs are target_tree and reduced acceptance at budget8/32k. Test 32k with larger budget if memory allows, or focus on freeing 64k memory for budget32 persist rather than optimizing rollback kernels."}}
{"run":96,"commit":"c499e6d","metric":0,"metrics":{"tps":0,"e2e_tps":0,"spec_sec":0,"gen_tokens":0,"steps":0,"committed":0,"step_ms":0,"pack_ms":0,"draft_ms":0,"topk_ms":0,"exact_ms":0,"exact_decode_ms":0,"acceptance":0},"status":"crash","description":"fast rollback fit probe at 32k context with budget 14","timestamp":1777506020282,"segment":1,"confidence":11.195080202773184,"asi":{"hypothesis":"32k context may free enough GPU memory for budget14 fast rollback persist, improving acceptance versus the budget8 fast-batched rollback run while keeping cheap state commit","rollback_reason":"budget14 persist allocated at 32k, but subsequent CUDA graph compute hit out-of-memory before benchmark metrics were emitted, so no throughput result","result":"persist allocation succeeded for 64 layers, 14 tokens, 1086.75 MiB, then CUDA OOM occurred in ggml_backend_cuda_graph_compute during target tree decode","next_action_hint":"32k frees enough memory for budget14 persist allocation but not enough working-memory headroom for compute; test an intermediate smaller budget such as 10 or 12, or reduce graph compute buffer pressure before revisiting budget14"}}
{"run":97,"commit":"c499e6d","metric":6.498729,"metrics":{"tps":6.498729,"e2e_tps":1.223055,"spec_sec":26.164,"gen_tokens":32,"steps":19,"committed":33,"step_ms":259.16,"pack_ms":1.06,"draft_ms":156.53,"topk_ms":16.75,"exact_ms":0,"exact_decode_ms":0,"acceptance":1.737},"status":"discard","description":"fast rollback fit probe at 32k context with budget 12","timestamp":1777506119588,"segment":1,"confidence":11.176576899258043,"asi":{"hypothesis":"32k context with budget12 may be the largest fast-rollback configuration that leaves enough compute headroom, improving acceptance versus budget8 without the budget14 CUDA OOM","rollback_reason":"budget12 fast rollback fit and stayed bit-equal, but acceptance fell to 1.74 over 19 steps and step time rose to 259 ms; primary TPS was far below the budget32 exact-validation best and below the 32k budget8 rollback probe","result":"persist allocated successfully at 931.50 MiB, fast_rollback=19, snapshot_replays=0, exact=0, target_tree=81.96 ms, rollback=0.66 ms, correctness PASS","next_action_hint":"budget12 worsens both acceptance and step time versus budget8 on this prompt; do not pursue 32k rollback budget sweep as an optimization. The useful finding is that rollback is cheap when persist fits; focus on freeing 64k memory or reducing target_tree cost."}}
{"run":98,"commit":"c499e6d","metric":7.723089,"metrics":{"tps":7.723089,"e2e_tps":1.206091,"spec_sec":26.532,"gen_tokens":32,"steps":18,"committed":33,"step_ms":230.19,"pack_ms":1.11,"draft_ms":137.84,"topk_ms":15.24,"exact_ms":0,"exact_decode_ms":0,"acceptance":1.833},"status":"discard","description":"64k fast rollback fit probe with smaller batch buffers and budget 8","timestamp":1777506225210,"segment":1,"confidence":11.158134659584107,"asi":{"hypothesis":"reducing n_batch/n_ubatch from 512 to 256 may free enough 64k GPU working memory for budget8 fast rollback persist while preserving the 64k prompt/proposal behavior better than lowering n_ctx to 32k","rollback_reason":"fast rollback fit and correctness passed, but budget8 acceptance stayed low at 1.83 over 18 steps and TPS remained below the budget32 exact-validation best","result":"64k with n_batch=256,n_ubatch=256 allocated 621.00 MiB persist, fast_rollback=18, snapshot_replays=0, exact=0, target_tree=73.86 ms, rollback=0.62 ms, correctness PASS","next_action_hint":"smaller batch buffers solve the 64k budget8 persist fit, but budget8 acceptance is too low; test whether n_batch=256 allows budget14 or higher persist, otherwise freeing memory alone at tiny budget is not enough"}}
{"run":99,"commit":"c499e6d","metric":7.011148,"metrics":{"tps":7.011148,"e2e_tps":1.201021,"spec_sec":26.644,"gen_tokens":32,"steps":17,"committed":33,"step_ms":268.48,"pack_ms":1.09,"draft_ms":160.71,"topk_ms":16.82,"exact_ms":0,"exact_decode_ms":0,"acceptance":1.941},"status":"discard","description":"64k fast rollback fit probe with smaller batch buffers and budget 14","timestamp":1777506326499,"segment":1,"confidence":10.999616549456363,"asi":{"hypothesis":"with n_batch/n_ubatch reduced to 256, 64k may have enough memory for budget14 fast rollback persist, improving acceptance over budget8 while keeping cheap rollback state commits","rollback_reason":"budget14 fast rollback fit and stayed bit-equal, but step time rose to 268 ms and acceptance only improved to 1.94, so primary TPS remained below both budget8 rollback and the budget32 exact-validation best","result":"64k n_batch=256,n_ubatch=256 allocated 1086.75 MiB persist, fast_rollback=17, snapshot_replays=0, exact=0, target_tree=86.66 ms, rollback=0.64 ms, correctness PASS","next_action_hint":"n_batch reduction frees enough memory for budget14, but target_tree+draft cost dominate and acceptance remains below the budget32 exact path; test whether budget22/32 fit with n_batch=256 only as a memory map, otherwise stop fast-rollback budget sweep and investigate target_tree cost or GPU target_feat ring."}}
