{"run":55,"commit":"abe969d","metric":9.003331,"metrics":{"tps":9.003331,"e2e_tps":1.282822,"spec_sec":24.945,"gen_tokens":32,"steps":16,"committed":33,"step_ms":222.14,"pack_ms":1.08,"draft_ms":150.07,"topk_ms":19.8,"exact_ms":51.16,"exact_decode_ms":0,"acceptance":2.062},"status":"discard","description":"test DDTree budget 40 after budget 32 improvement","timestamp":1777499863976,"segment":1,"confidence":19.318235385991656,"asi":{"hypothesis":"budget 40 may further improve proposal coverage beyond budget 32 while keeping the same number of exact-validation steps","rollback_reason":"acceptance matched budget 32 but step time regressed to 222 ms, especially draft/topk, so primary TPS fell below the budget-32 best","next_action_hint":"budget 32 appears better than 40 on this prompt; test budget 28/36 or repeat 32 for noise before changing server defaults further"}}
{"run":56,"commit":"abe969d","metric":9.144111,"metrics":{"tps":9.144111,"e2e_tps":1.287467,"spec_sec":24.855,"gen_tokens":32,"steps":16,"committed":33,"step_ms":218.72,"pack_ms":1.09,"draft_ms":145.96,"topk_ms":20.45,"exact_ms":51.19,"exact_decode_ms":0,"acceptance":2.062},"status":"discard","description":"test DDTree budget 28 below budget-32 best","timestamp":1777499961123,"segment":1,"confidence":19.01142448327141,"asi":{"hypothesis":"budget 28 may retain the step-count win from budget 32 while reducing tree/proposal overhead","rollback_reason":"steps and acceptance matched budget 32, but step time was slower and primary TPS remained below 9.82","next_action_hint":"budget 32 remains the best tested budget; test 30/34 or repeat 32 to confirm noise"}}
{"run":57,"commit":"abe969d","metric":8.99928,"metrics":{"tps":8.99928,"e2e_tps":1.257022,"spec_sec":25.457,"gen_tokens":32,"steps":16,"committed":33,"step_ms":222.24,"pack_ms":1.08,"draft_ms":149.56,"topk_ms":20.23,"exact_ms":51.33,"exact_decode_ms":0,"acceptance":2.062},"status":"discard","description":"repeat DDTree budget 32 to confirm previous best against noise","timestamp":1777500057910,"segment":1,"confidence":19.196128504310348,"asi":{"hypothesis":"repeat budget 32 because the previous 9.82 TPS improvement may include noise; confirm whether the step-count/acceptance gain is stable","rollback_reason":"repeat preserved the 16-step and 2.06 acceptance behavior but step time regressed to 222 ms, so primary TPS was below the kept best","next_action_hint":"budget 32 still looks structurally useful via fewer steps, but compare future ideas against a noisy 9.0-9.8 TPS range rather than a single best run"}}
{"run":58,"commit":"abe969d","metric":9.0151,"metrics":{"tps":9.0151,"e2e_tps":1.280307,"spec_sec":24.994,"gen_tokens":32,"steps":16,"committed":33,"step_ms":221.85,"pack_ms":1.07,"draft_ms":148.88,"topk_ms":20.24,"exact_ms":51.62,"exact_decode_ms":0,"acceptance":2.062},"status":"discard","description":"test DDTree budget 30 between budget 28 and 32","timestamp":1777500149659,"segment":1,"confidence":19.077213862263655,"asi":{"hypothesis":"budget 30 may keep the 16-step acceptance gain from budget 32 while trimming proposal overhead versus larger budgets","rollback_reason":"budget 30 matched the 16-step/2.06 acceptance pattern but step time stayed around 222 ms and primary TPS remained below the kept budget-32 best","next_action_hint":"budget 30/28/40 do not beat budget 32; try budget 34/36 or switch away from budget tuning if repeats remain noisy"}}
{"run":59,"commit":"abe969d","metric":9.208951,"metrics":{"tps":9.208951,"e2e_tps":1.286587,"spec_sec":24.872,"gen_tokens":32,"steps":16,"committed":33,"step_ms":217.18,"pack_ms":1.1,"draft_ms":144.66,"topk_ms":19.97,"exact_ms":51.42,"exact_decode_ms":0,"acceptance":2.062},"status":"discard","description":"test DDTree budget 36 above budget-32 best","timestamp":1777500249227,"segment":1,"confidence":18.755483015403495,"asi":{"hypothesis":"budget 36 may preserve the 16-step acceptance gain from budget 32 while giving slightly better branch coverage than 30/32 without the overhead seen at 40","rollback_reason":"budget 36 passed and was better than 28/30/40, but still below the kept budget-32 best of 9.82 TPS","next_action_hint":"budget 34 is the last nearby budget worth testing; otherwise budget tuning appears saturated and noisy around 9.0-9.8 TPS"}}
{"run":60,"commit":"abe969d","metric":9.048545,"metrics":{"tps":9.048545,"e2e_tps":1.250684,"spec_sec":25.586,"gen_tokens":32,"steps":16,"committed":33,"step_ms":221.03,"pack_ms":1.08,"draft_ms":147.2,"topk_ms":21.15,"exact_ms":51.57,"exact_decode_ms":0,"acceptance":2.062},"status":"discard","description":"test DDTree budget 34 near budget-32 best","timestamp":1777500350130,"segment":1,"confidence":18.510168209448402,"asi":{"hypothesis":"budget 34 may retain the 16-step acceptance improvement from budget 32 while finding a lower-overhead point than 36/40","rollback_reason":"budget 34 matched the 16-step and 2.06 acceptance pattern, but topk/step time were worse and primary TPS remained below the kept budget-32 best","next_action_hint":"stop local budget sweep around 32; nearby budgets 28/30/34/36/40 all failed to beat 32, so switch to a different bottleneck such as exact target decode or draft compute"}}
{"run":61,"commit":"abe969d","metric":8.570174,"metrics":{"tps":8.570174,"e2e_tps":1.266524,"spec_sec":25.266,"gen_tokens":32,"steps":17,"committed":33,"step_ms":219.64,"pack_ms":1.35,"draft_ms":150.5,"topk_ms":19.51,"exact_ms":48.24,"exact_decode_ms":0,"acceptance":1.941},"status":"discard","description":"test budget 32 with target feature window 160","timestamp":1777500462376,"segment":1,"confidence":18.755483015403495,"asi":{"hypothesis":"with the larger budget-32 proposal tree, a slightly longer target-feature window may improve draft proposal quality enough to offset extra pack/draft cost","rollback_reason":"target_feat_ctx=160 lost the budget-32 structural gain: steps rose from 16 to 17 and acceptance fell to 1.94, so TPS dropped","next_action_hint":"keep target feature window at 128 for budget-32; do not combine larger windows with larger budget on this workload"}}
{"run":62,"commit":"abe969d","metric":9.649133,"metrics":{"tps":9.649133,"e2e_tps":1.291572,"spec_sec":24.776,"gen_tokens":32,"steps":17,"committed":33,"step_ms":195.08,"pack_ms":0.95,"draft_ms":128.19,"topk_ms":18.6,"exact_ms":47.32,"exact_decode_ms":0,"acceptance":1.941},"status":"discard","description":"test budget 32 with smaller target feature window 112","timestamp":1777500568011,"segment":1,"confidence":18.510168209448402,"asi":{"hypothesis":"with budget 32, a smaller 112-token target-feature window may reduce draft compute enough to offset losing some proposal quality","rollback_reason":"draft/step time improved significantly, but steps rose to 17 and acceptance fell to 1.94; primary TPS stayed below the kept budget-32 best of 9.82","next_action_hint":"try an intermediate window such as 120 with budget 32, or repeat 112 if prioritizing lower draft latency over best TPS"}}
{"run":63,"commit":"abe969d","metric":8.489392,"metrics":{"tps":8.489392,"e2e_tps":1.270648,"spec_sec":25.184,"gen_tokens":32,"steps":17,"committed":33,"step_ms":221.73,"pack_ms":1.02,"draft_ms":152.51,"topk_ms":20.3,"exact_ms":47.87,"exact_decode_ms":0,"acceptance":1.941},"status":"discard","description":"test budget 32 with target feature window 120","timestamp":1777500665459,"segment":1,"confidence":18.755483015403495,"asi":{"hypothesis":"target_feat_ctx=120 may sit between 112 and 128, retaining some draft-cost savings while avoiding the acceptance loss seen at 112","rollback_reason":"120 did not recover budget-32 acceptance; steps stayed 17 and draft/step time was worse than 112 and 128, so primary TPS fell","next_action_hint":"do not continue fine-tuning between 112 and 128; use 128 for structural 16-step behavior or 112 only as lower-latency non-best variant"}}
{"run":64,"commit":"abe969d","metric":9.104151,"metrics":{"tps":9.104151,"e2e_tps":1.286174,"spec_sec":24.88,"gen_tokens":32,"steps":16,"committed":33,"step_ms":219.68,"pack_ms":1.07,"draft_ms":147.78,"topk_ms":19.46,"exact_ms":51.33,"exact_decode_ms":0,"acceptance":2.062},"status":"discard","description":"test budget 32 with DDTree micro-profile logging disabled","timestamp":1777500762894,"segment":1,"confidence":18.510168209448402,"asi":{"hypothesis":"per-step DDTree micro-profile logging may add overhead in the budget-32 configuration, so disabling it could improve production-like decode TPS","rollback_reason":"profile-disabled run preserved the 16-step/2.06 acceptance behavior but did not beat the kept budget-32 best; primary TPS stayed in the noisy ~9.0 band","next_action_hint":"profiling can remain disabled in production, but it is not a major optimization lever; move to draft compute or exact decode changes"}}
{"run":65,"commit":"abe969d","metric":8.427062,"metrics":{"tps":8.427062,"e2e_tps":1.266675,"spec_sec":25.263,"gen_tokens":32,"steps":17,"committed":33,"step_ms":223.37,"pack_ms":1.06,"draft_ms":153.86,"topk_ms":20.47,"exact_ms":47.95,"exact_decode_ms":0,"acceptance":1.941},"status":"discard","description":"test budget 32 with 32k context and q8 KV","timestamp":1777500859781,"segment":1,"confidence":18.755483015403495,"asi":{"hypothesis":"combine the budget-32 branch-coverage gain with the previously viable 32k/q8_0 context to see if q8 exact decode or lower context improves throughput","rollback_reason":"q8_0 + 32k lost the budget-32 structural gain: steps rose to 17 and acceptance fell to 1.94, with slower draft/step time","next_action_hint":"keep q4_0 64k for budget-32; q8_0/32k does not combine well with this proposal tree"}}
{"run":66,"commit":"abe969d","metric":8.867312,"metrics":{"tps":8.867312,"e2e_tps":1.283903,"spec_sec":24.924,"gen_tokens":32,"steps":17,"committed":33,"step_ms":212.28,"pack_ms":0.96,"draft_ms":143.28,"topk_ms":20.12,"exact_ms":47.89,"exact_decode_ms":0,"acceptance":1.941},"status":"discard","description":"test budget 32 with target feature window 116","timestamp":1777500957905,"segment":1,"confidence":18.510168209448402,"asi":{"hypothesis":"target_feat_ctx=116 may keep most of the draft-cost reduction seen at 112 while recovering some proposal quality toward the 128-window budget-32 path","rollback_reason":"116 kept lower draft cost but still lost the budget-32 structural win: steps stayed 17 and acceptance stayed 1.94, so primary TPS remained below best","next_action_hint":"stop testing sub-128 windows with budget 32; they lower per-step cost but consistently lose the 16-step acceptance behavior"}}
{"run":67,"commit":"abe969d","metric":8.537135,"metrics":{"tps":8.537135,"e2e_tps":1.284986,"spec_sec":24.903,"gen_tokens":32,"steps":17,"committed":33,"step_ms":220.49,"pack_ms":1.07,"draft_ms":151.17,"topk_ms":20.16,"exact_ms":48.05,"exact_decode_ms":0,"acceptance":1.941},"status":"discard","description":"test budget 32 with 32k context and q4 KV","timestamp":1777501067545,"segment":1,"confidence":18.755483015403495,"asi":{"hypothesis":"for prompts fitting under 32k, lowering n_ctx while keeping q4 KV may reduce decode memory/compute overhead and combine with the budget-32 proposal tree","rollback_reason":"32k context lost the budget-32 structural gain: steps rose to 17 and acceptance fell to 1.94, with TPS well below the 64k budget-32 best","next_action_hint":"keep 64k q4 for budget-32 on this workload; context reduction changes proposal/target behavior enough to lose acceptance"}}
{"run":68,"commit":"abe969d","metric":9.041183,"metrics":{"tps":9.041183,"e2e_tps":1.284161,"spec_sec":24.919,"gen_tokens":32,"steps":16,"committed":33,"step_ms":221.21,"pack_ms":1.14,"draft_ms":148.76,"topk_ms":20.16,"exact_ms":51.12,"exact_decode_ms":0,"acceptance":2.062},"status":"discard","description":"test budget 32 with target feature window 136","timestamp":1777501168604,"segment":1,"confidence":18.510168209448402,"asi":{"hypothesis":"target_feat_ctx=136 may preserve the 16-step budget-32 acceptance behavior while being close enough to 128 to avoid the overhead/regression seen at 160","rollback_reason":"136 preserved the 16-step and 2.06 acceptance behavior, but step time was around 221 ms and primary TPS stayed below the budget-32 best","next_action_hint":"128 remains the best window for budget-32; larger windows preserve acceptance but do not improve throughput"}}
{"run":69,"commit":"abe969d","metric":9.219989,"metrics":{"tps":9.219989,"e2e_tps":1.28236,"spec_sec":24.954,"gen_tokens":32,"steps":16,"committed":33,"step_ms":216.92,"pack_ms":1.09,"draft_ms":144.92,"topk_ms":19.97,"exact_ms":50.9,"exact_decode_ms":0,"acceptance":2.062},"status":"discard","description":"test budget 32 with draft top-k capped at 4","timestamp":1777502096247,"segment":1,"confidence":15.883380263274644,"asi":{"hypothesis":"budget 32 may not need K=8 alternatives per row; capping draft top-k to 4 could preserve the 16-step acceptance behavior while reducing top-k/tree overhead","rollback_reason":"K=4 preserved 16 steps and 2.06 acceptance but primary TPS stayed below the kept budget-32 best; topk did not materially improve","next_action_hint":"top-k cardinality is not the main cost; do not add a TOP_K knob unless needed for diagnostics"}}
{"run":70,"commit":"abe969d","metric":9.147875,"metrics":{"tps":9.147875,"e2e_tps":1.279335,"spec_sec":25.013,"gen_tokens":32,"steps":16,"committed":34,"step_ms":218.63,"pack_ms":1.08,"draft_ms":147.84,"topk_ms":17.36,"exact_ms":52.32,"exact_decode_ms":0,"acceptance":2.125},"status":"discard","description":"cap DDTree proposal rows to 8 for budget 32","timestamp":1777502354709,"segment":1,"confidence":15.856576119639561,"asi":{"hypothesis":"exact-validation path rarely needs all 15 draft rows; capping DDTree proposal rows to 8 may preserve acceptance while reducing CPU top-k scan cost","rollback_reason":"topk improved to 17.36 ms and acceptance stayed strong, but exact cost rose and total step time remained below the kept best; also broad prompts could need deeper rows","next_action_hint":"tree-row capping can reduce topk but is not enough alone; avoid keeping because it risks hurting prompts with long accepted runs"}}
{"run":71,"commit":"abe969d","metric":8.451759,"metrics":{"tps":8.451759,"e2e_tps":1.584547,"spec_sec":26.506,"gen_tokens":42,"steps":23,"committed":42,"step_ms":216.06,"pack_ms":1.03,"draft_ms":149.5,"topk_ms":20.1,"exact_ms":45.4,"exact_decode_ms":0,"acceptance":1.826},"status":"discard","description":"validate budget 32 on longer generation request","timestamp":1777502458355,"segment":1,"confidence":15.883380263274644,"asi":{"hypothesis":"longer generation should check whether the budget-32 16-step gain generalizes beyond the short 32-token sample and reduce overfitting risk","rollback_reason":"the prompt ended at 42 generated tokens and acceptance fell to 1.83; decode TPS below budget-32 short-run best","next_action_hint":"use an additional non-EOS prompt fixture for robust validation; this prompt is useful but not sufficient for long-run budget tuning"}}
{"run":72,"commit":"abe969d","metric":9.227646,"metrics":{"tps":9.227646,"e2e_tps":1.283852,"spec_sec":24.925,"gen_tokens":32,"steps":16,"committed":33,"step_ms":216.74,"pack_ms":1.08,"draft_ms":144.28,"topk_ms":20.3,"exact_ms":51.03,"exact_decode_ms":0,"acceptance":2.062},"status":"discard","description":"test pure best-first DDTree without greedy chain seed at budget 32","timestamp":1777502608147,"segment":1,"confidence":15.856576119639561,"asi":{"hypothesis":"chain_seed spends many budget-32 nodes on a deep greedy spine even though exact acceptance averages only about 2 tokens; pure best-first may allocate more shallow alternatives and improve proposal coverage","rollback_reason":"chain_seed=0 preserved the 16-step/2.06 acceptance behavior but did not beat the kept budget-32 best; no primary improvement and it may be less robust on prompts with long greedy runs","next_action_hint":"keep chain_seed enabled; if revisiting tree construction, use a hybrid depth cap rather than disabling the greedy spine entirely"}}
{"run":73,"commit":"abe969d","metric":9.040774,"metrics":{"tps":9.040774,"e2e_tps":1.281897,"spec_sec":24.963,"gen_tokens":32,"steps":16,"committed":33,"step_ms":221.22,"pack_ms":1.09,"draft_ms":148.96,"topk_ms":20.16,"exact_ms":50.98,"exact_decode_ms":0,"acceptance":2.062},"status":"discard","description":"hybrid DDTree chain seed capped to depth 4 at budget 32","timestamp":1777502734449,"segment":1,"confidence":15.776850112479453,"asi":{"hypothesis":"cap the pre-inserted greedy spine to depth 4 so budget-32 keeps robust shallow branch coverage while still preserving enough greedy-chain depth","rollback_reason":"chain-depth cap preserved the 16-step/2.06 acceptance pattern but step time stayed around 221 ms and did not beat the kept budget-32 best","next_action_hint":"hybrid chain-depth capping does not improve this workload; avoid further tree construction tweaks unless using a broader prompt corpus"}}
{"run":74,"commit":"abe969d","metric":9.173891,"metrics":{"tps":9.173891,"e2e_tps":1.284058,"spec_sec":24.921,"gen_tokens":32,"steps":16,"committed":33,"step_ms":218.01,"pack_ms":1.07,"draft_ms":146.71,"topk_ms":19.2,"exact_ms":51,"exact_decode_ms":0,"acceptance":2.062},"status":"discard","description":"test budget 32 with target feature window 124","timestamp":1777502840662,"segment":1,"confidence":15.556627806464379,"asi":{"hypothesis":"target_feat_ctx=124 may be the smallest window that preserves the budget-32 16-step acceptance behavior while slightly reducing draft compute versus 128","rollback_reason":"124 preserved 16 steps and 2.06 acceptance, but primary TPS stayed below the kept budget-32 best and within the noisy 9.0-9.2 band","next_action_hint":"128 remains the best kept setting; 124 is viable but not a primary improvement, so move away from window tuning"}}
{"run":75,"commit":"abe969d","metric":0,"metrics":{"tps":0,"e2e_tps":0,"spec_sec":21.522,"gen_tokens":0,"steps":1,"committed":0,"step_ms":0,"pack_ms":3.54,"draft_ms":201.54,"topk_ms":15.37,"exact_ms":0,"exact_decode_ms":0,"acceptance":0},"status":"crash","description":"fast rollback budget 14 with draft GPU layers 5","timestamp":1777502969042,"segment":1,"confidence":15.556627806464379,"asi":{"hypothesis":"budget 14 reduces persist to about 1.09 GiB; moving one draft layer off GPU may free enough VRAM for fast rollback while keeping draft faster than the known ngld3 path","rollback_reason":"persist allocation still OOMed at 1086.75 MiB, and draft time already rose to 201 ms with ngld5; no tokens generated","next_action_hint":"do not pursue small draft-offload reductions for persist fit; memory fragmentation or compute buffers still prevent budget14 persist allocation, and draft slowdown erodes expected gains"}}
{"run":76,"commit":"abe969d","metric":9.074822,"metrics":{"tps":9.074822,"e2e_tps":1.279232,"spec_sec":25.015,"gen_tokens":32,"steps":16,"committed":33,"step_ms":220.39,"pack_ms":1.09,"draft_ms":148.35,"topk_ms":19.94,"exact_ms":50.97,"exact_decode_ms":0,"acceptance":2.062},"status":"discard","description":"single memcpy fast path for one-token exact hidden-capture ingest","timestamp":1777503129647,"segment":1,"confidence":14.215306045687464,"asi":{"hypothesis":"exact validation ingests one hidden-capture token at a time; for n_tokens=1 the five layer slices are contiguous and can be copied into the target_feat ring with one memcpy instead of five","rollback_reason":"correctness passed but ingest stayed about 9.19 ms and primary TPS remained below the budget-32 best; hidden-capture retrieval/device transfer dominates, not the five small memcpy calls","next_action_hint":"do not optimize CPU memcpy in ingest further; a GPU-resident target_feat ring or capture path would be needed for meaningful ingest savings"}}
{"run":77,"commit":"abe969d","metric":8.99847,"metrics":{"tps":8.99847,"e2e_tps":1.275307,"spec_sec":25.092,"gen_tokens":32,"steps":16,"committed":34,"step_ms":222.26,"pack_ms":1.08,"draft_ms":150.91,"topk_ms":17.85,"exact_ms":52.38,"exact_decode_ms":0,"acceptance":2.125},"status":"discard","description":"cap draft logits outputs to tree rows for budget 32 row-8 proposal","timestamp":1777503251223,"segment":1,"confidence":13.227183816638313,"asi":{"hypothesis":"when capping proposal rows to 8, also avoid requesting draft logits for rows beyond that cap to reduce lm_head/logits work while keeping exact validation authoritative","rollback_reason":"correctness passed and topk remained lower, but draft time increased to 150.91 ms and total TPS fell below the budget-32 best; sparse logits flags do not reduce the dominant draft compute here","next_action_hint":"do not pursue output-row pruning in the draft path; focus on draft internal compute or exact target decode instead"}}
{"run":78,"commit":"abe969d","metric":9.495774,"metrics":{"tps":9.495774,"e2e_tps":1.288245,"spec_sec":24.84,"gen_tokens":32,"steps":16,"committed":33,"step_ms":210.62,"pack_ms":1.09,"draft_ms":138.52,"topk_ms":19.88,"exact_ms":51.09,"exact_decode_ms":0,"acceptance":2.062},"status":"discard","description":"test DDTree budget 26 below 28/32 threshold","timestamp":1777503357658,"segment":1,"confidence":12.929750236155215,"asi":{"hypothesis":"budget 26 may be the smallest budget that preserves the 16-step acceptance gain while reducing tree/proposal overhead versus budget 28/32","rollback_reason":"budget 26 preserved 16 steps and improved step time to 210.62 ms, but primary TPS remained below the kept budget-32 best of 9.82","next_action_hint":"budget 26 is promising and less noisy than nearby budgets; test budget 24 or repeat 26 before considering changing the configured default"}}
