{"run":169,"commit":"de24439","metric":6.018997,"metrics":{"e2e_tps":1.197694,"spec_sec":26.718,"gen_tokens":32,"steps":25,"committed":32,"step_ms":212.66,"pack_ms":1.04,"draft_ms":158.08,"topk_ms":21.8,"exact_ms":31.7,"acceptance":1.28},"status":"discard","description":"compute draft lm_head only for non-root output rows","timestamp":1777559673944,"segment":2,"confidence":7.637615029697407,"asi":{"hypothesis":"applying out_ids before the draft lm_head and omitting the unused root logits row should reduce draft output projection work","rollback_reason":"correctness passed but proposal alignment broke: acceptance fell to 1.28 and steps rose to 25; draft_ms also increased to 158ms","next_action_hint":"the dflash draft logits rows are position-sensitive; do not compact rows before lm_head without verifying row/order semantics against standalone DFlash"}}
{"run":170,"commit":"de24439","metric":10.329045,"metrics":{"e2e_tps":1.302613,"spec_sec":24.566,"gen_tokens":32,"steps":14,"committed":33,"step_ms":221.29,"pack_ms":1.11,"draft_ms":142,"topk_ms":20.07,"exact_ms":58.08,"acceptance":2.357},"status":"discard","description":"allow graph reuse for single-sequence DFlash draft ubatch view","timestamp":1777559819914,"segment":2,"confidence":7.711205551462638,"asi":{"hypothesis":"DFlash draft graph reuse may be blocked by non-owning single-sequence ubatch views; allowing reuse could enable CUDA graph replay and reduce draft decode overhead","rollback_reason":"profile still showed reused=0 on every draft ubatch, so this was not the reuse blocker; TPS 10.33 was below kept 10.59 and within noise","next_action_hint":"if pursuing graph reuse, instrument llm_graph_params::allow_reuse to print which field differs rather than guessing"}}
{"run":171,"commit":"de24439","metric":9.832298,"metrics":{"e2e_tps":1.296229,"spec_sec":24.687,"gen_tokens":32,"steps":14,"committed":33,"step_ms":232.47,"pack_ms":1.13,"draft_ms":152.38,"topk_ms":20.99,"exact_ms":57.94,"acceptance":2.357},"status":"discard","description":"force DFlash draft graph params reuse to test CUDA graph replay hypothesis","timestamp":1777559990277,"segment":2,"confidence":7.637615029697407,"asi":{"hypothesis":"if llm_graph_params comparison is the blocker, forcing DFlash draft allow_reuse true should make reused=1 and reduce draft compute overhead","rollback_reason":"profile still showed reused=0 for every draft ubatch, so the graph is reset before can_reuse matters, likely by the DFlash recurrent memory update path; TPS was worse","next_action_hint":"graph reuse optimization would need to avoid gf_res_prev reset in the memory update path or use a separate persistent draft graph; not a simple params comparison fix"}}
{"run":172,"commit":"de24439","metric":9.756752,"metrics":{"e2e_tps":1.294656,"spec_sec":24.717,"gen_tokens":32,"steps":14,"committed":33,"step_ms":234.27,"pack_ms":1.13,"draft_ms":154.23,"topk_ms":20.78,"exact_ms":58.09,"acceptance":2.357},"status":"discard","description":"skip gf_res_prev reset for DFlash draft memory update","timestamp":1777560098862,"segment":2,"confidence":7.565415826302686,"asi":{"hypothesis":"the DFlash recurrent memory update resets gf_res_prev before every draft decode; skipping that reset may permit graph/CUDA graph reuse and reduce draft decode overhead","rollback_reason":"profile still showed reused=0 for every draft step and TPS fell to 9.76; the reset was not the only blocker or reuse is disabled elsewhere","next_action_hint":"avoid more graph-reuse guesses; instrument process_ubatch/can_reuse if this path is revisited"}}
{"run":173,"commit":"de24439","metric":9.997438,"metrics":{"e2e_tps":1.300232,"spec_sec":24.611,"gen_tokens":32,"steps":14,"committed":33,"step_ms":228.63,"pack_ms":1.12,"draft_ms":149.42,"topk_ms":20.16,"exact_ms":57.9,"acceptance":2.357},"status":"discard","description":"draft context n_batch/n_ubatch 16 exactly matching DFlash block size","timestamp":1777560191687,"segment":2,"confidence":8.276184968104477,"asi":{"hypothesis":"setting draft n_batch/n_ubatch to the exact 16-token block size may reduce draft graph reserve/buffer overhead and improve draft decode","rollback_reason":"correctness passed but draft_ms 149ms and TPS 10.00 were below the kept best; smaller draft batch did not improve compute","next_action_hint":"keep draft n_batch cap at 64; batch-size memory savings are not a decode-speed path here"}}
{"run":174,"commit":"de24439","metric":10.155571,"metrics":{"e2e_tps":1.315249,"spec_sec":24.33,"gen_tokens":32,"steps":14,"committed":34,"step_ms":225.07,"pack_ms":1.12,"draft_ms":145.05,"topk_ms":19.36,"exact_ms":59.5,"acceptance":2.429},"status":"discard","description":"draft context n_ctx 256 to reduce draft buffer footprint","timestamp":1777560274649,"segment":2,"confidence":8.845601423014735,"asi":{"hypothesis":"shrinking draft n_ctx to 256 may reduce scheduler/compute-buffer overhead for the DFlash draft graph while retaining correctness","rollback_reason":"correctness passed and acceptance rose to 2.43, but TPS 10.16 stayed below kept 10.59; draft_ms 145ms is only within noise of baseline","next_action_hint":"draft n_ctx can be very small without breaking correctness, but it is not a clear speedup; if memory footprint matters, retest n_ctx=256 separately for server/fast-rollback fit"}}
{"run":175,"commit":"de24439","metric":10.232403,"metrics":{"e2e_tps":1.301766,"spec_sec":24.582,"gen_tokens":32,"steps":14,"committed":33,"step_ms":223.38,"pack_ms":1.16,"draft_ms":144.6,"topk_ms":19.79,"exact_ms":57.8,"acceptance":2.357},"status":"discard","description":"block_size 20 to test larger DFlash draft block without acceptance loss","timestamp":1777560437231,"segment":2,"confidence":8.45678600725038,"asi":{"hypothesis":"a larger draft block may expose more candidate positions for the same budget and improve acceptance without substantially increasing draft decode time","rollback_reason":"block_size 20 preserved the same 14-step acceptance pattern and did not beat the kept 10.59 TPS; no improvement despite draft_ms being in a good noise band","next_action_hint":"block size changes mostly do not affect draft_ms or acceptance on this prompt; reset block_size default and focus elsewhere"}}
{"run":176,"commit":"de24439","metric":10.295083,"metrics":{"e2e_tps":1.303144,"spec_sec":24.556,"gen_tokens":32,"steps":14,"committed":33,"step_ms":222.02,"pack_ms":1.11,"draft_ms":142.8,"topk_ms":20.29,"exact_ms":57.78,"acceptance":2.357},"status":"discard","description":"block_size 32 with budget 32 under pure best-first K=4","timestamp":1777560542708,"segment":2,"confidence":8.10071276246994,"asi":{"hypothesis":"larger DFlash block_size 32 may let the same budget explore deeper draft positions and improve acceptance while draft compute remains mostly fixed-overhead","rollback_reason":"acceptance stayed identical at 2.357 and TPS 10.30 remained below kept 10.59; larger block did not change the accepted path","next_action_hint":"block_size can vary widely without affecting this prompt's accepted path; no need for more block_size sweeps unless cross-prompt behavior differs"}}
{"run":177,"commit":"de24439","metric":9.860292,"metrics":{"e2e_tps":1.307831,"spec_sec":24.468,"gen_tokens":32,"steps":14,"committed":34,"step_ms":231.81,"pack_ms":1.09,"draft_ms":150.43,"topk_ms":20.62,"exact_ms":59.64,"acceptance":2.429},"status":"discard","description":"draft n_ctx 256 combined with block_size 32","timestamp":1777560663130,"segment":2,"confidence":8.45678600725038,"asi":{"hypothesis":"combining small draft n_ctx with a larger block may keep the higher 2.43 acceptance while reducing or amortizing draft decode overhead","rollback_reason":"acceptance stayed at 2.43 but draft_ms rose to 150ms and TPS fell to 9.86; the combination is worse than either isolated noisy candidate","next_action_hint":"do not combine n_ctx=256 and larger block_size for speed; reset block_size default before continuing"}}
{"run":178,"commit":"de24439","metric":6.159437,"metrics":{"e2e_tps":1.203188,"spec_sec":26.596,"gen_tokens":32,"steps":24,"committed":33,"step_ms":216.47,"pack_ms":1.03,"draft_ms":160.45,"topk_ms":21.04,"exact_ms":33.93,"acceptance":1.375},"status":"discard","description":"skip target K/V attention for last two DFlash draft layers","timestamp":1777560789901,"segment":2,"confidence":7.884112887310015,"asi":{"hypothesis":"dropping target-feature K/V matmuls in later draft layers may reduce draft compute while leaving enough proposal quality for exact validation","rollback_reason":"proposal quality collapsed: acceptance 1.38, 24 steps, and draft_ms increased to 160ms; the altered graph likely lost CUDA efficiency and model accuracy","next_action_hint":"do not prune target K/V attention inside trained DFlash layers; accuracy loss overwhelms any theoretical compute saving"}}
{"run":179,"commit":"de24439","metric":9.67981,"metrics":{"e2e_tps":1.291156,"spec_sec":24.784,"gen_tokens":32,"steps":15,"committed":32,"step_ms":220.39,"pack_ms":1.1,"draft_ms":146.41,"topk_ms":20.39,"exact_ms":52.45,"acceptance":2.133},"status":"discard","description":"use only last 32 target_feat positions for last two DFlash draft layers","timestamp":1777560915280,"segment":2,"confidence":8.155576462101964,"asi":{"hypothesis":"later DFlash draft layers may only need a short recent target-feature window; limiting them to 32 positions could reduce K/V matmul and attention compute with smaller accuracy loss than dropping target K/V entirely","rollback_reason":"draft_ms did not improve meaningfully and acceptance fell to 2.13, adding an extra step; TPS 9.68 is below baseline","next_action_hint":"per-layer target window truncation hurts proposal quality before it produces measurable draft speedup; avoid this approximation"}}
{"run":180,"commit":"de24439","metric":8.819071,"metrics":{"e2e_tps":1.275714,"spec_sec":25.084,"gen_tokens":32,"steps":15,"committed":33,"step_ms":241.9,"pack_ms":1.12,"draft_ms":162.84,"topk_ms":23.27,"exact_ms":54.64,"acceptance":2.2},"status":"discard","description":"use last 64 target_feat positions only for final DFlash draft layer","timestamp":1777561023846,"segment":2,"confidence":7.565415826302686,"asi":{"hypothesis":"truncating only the final draft layer to a 64-position target window may preserve most quality while reducing one layer's K/V and attention cost","rollback_reason":"acceptance dropped to 2.20 and draft_ms worsened to 163ms; the graph variant is both less accurate and slower","next_action_hint":"stop per-layer target window truncation experiments; the trained graph wants the full 128-window layout"}}
{"run":181,"commit":"de24439","metric":9.513107,"metrics":{"e2e_tps":1.266624,"spec_sec":25.264,"gen_tokens":32,"steps":14,"committed":33,"step_ms":240.27,"pack_ms":1.11,"draft_ms":158,"topk_ms":22.79,"exact_ms":58.34,"acceptance":2.357},"status":"discard","description":"disable flash_attn flag only for DFlash draft context","timestamp":1777561140520,"segment":2,"confidence":7.420714849615349,"asi":{"hypothesis":"for the small DFlash draft attention shape, disabling the draft context flash-attention flag might choose a lower-overhead kernel","rollback_reason":"draft_ms worsened to 158ms and TPS fell to 9.51; flash attention should stay enabled for the draft context","next_action_hint":"do not disable draft flash attention; attention kernel changes need a targeted custom kernel, not the generic non-flash path"}}
{"run":182,"commit":"de24439","metric":10.198618,"metrics":{"e2e_tps":1.300654,"spec_sec":24.603,"gen_tokens":32,"steps":14,"committed":33,"step_ms":224.12,"pack_ms":1.12,"draft_ms":145.1,"topk_ms":19.86,"exact_ms":58,"acceptance":2.357},"status":"discard","description":"disable detailed DFlash draft ubatch profiling logs in benchmark run","timestamp":1777561240315,"segment":2,"confidence":7.406063452435399,"asi":{"hypothesis":"LLAMA_DDTREE_PROFILE logging inside every draft llama_decode may add measurable draft overhead; disabling it should improve draft_ms without losing driver metrics","rollback_reason":"TPS 10.20 and draft_ms 145ms did not beat the kept 10.59 run; any logging overhead is smaller than run-to-run noise","next_action_hint":"profile logs are useful for draft diagnostics; keep the benchmark default profiling unless doing production latency measurements"}}
{"run":183,"commit":"de24439","metric":10.448024,"metrics":{"e2e_tps":1.300126,"spec_sec":24.613,"gen_tokens":32,"steps":14,"committed":33,"step_ms":218.77,"pack_ms":1.11,"draft_ms":139.63,"topk_ms":20.23,"exact_ms":57.77,"acceptance":2.357},"status":"discard","description":"truly omit LLAMA_DDTREE_PROFILE env to remove draft ubatch logging","timestamp":1777561340487,"segment":2,"confidence":7.5178283267860095,"asi":{"hypothesis":"the script was still setting an empty LLAMA_DDTREE_PROFILE env var, so profiling remained enabled; conditionally omitting it should reduce draft logging overhead","rollback_reason":"draft_ms improved to 139.6ms but TPS 10.45 still did not beat kept best 10.59; as a benchmark-control change it should not be kept unless it clearly improves primary","next_action_hint":"profile omission is a useful production-latency check; reset the benchmark to profiling-on for diagnostics or repeat no-profile if the target metric should exclude profiler overhead"}}
{"run":184,"commit":"de24439","metric":8.95165,"metrics":{"e2e_tps":1.280307,"spec_sec":24.994,"gen_tokens":32,"steps":17,"committed":33,"step_ms":210.28,"pack_ms":1.09,"draft_ms":146.42,"topk_ms":15.12,"exact_ms":47.62,"acceptance":1.941},"status":"discard","description":"skip logsumexp in top-k extraction using raw scaled logits","timestamp":1777561476120,"segment":2,"confidence":7.333912639063997,"asi":{"hypothesis":"removing per-vocab exp/logsumexp from draft top-k should cut topk_ms while exact validation preserves output correctness","rollback_reason":"topk_ms improved from about 20ms to 15ms, but proposal scoring changed enough to drop acceptance to 1.94 and require 17 steps; TPS fell to 8.95","next_action_hint":"try a cheaper row-relative score or approximate length penalty if pursuing top-k CPU cost, but raw logits alone distort tree ranking"}}
{"run":185,"commit":"de24439","metric":9.468352,"metrics":{"e2e_tps":1.284058,"spec_sec":24.921,"gen_tokens":32,"steps":16,"committed":33,"step_ms":211.23,"pack_ms":1.09,"draft_ms":144.33,"topk_ms":15.24,"exact_ms":50.53,"acceptance":2.062},"status":"discard","description":"top-k extraction with row-relative scores instead of logsumexp","timestamp":1777561568397,"segment":2,"confidence":7.124543556285478,"asi":{"hypothesis":"row-relative top-k scores may preserve within-row candidate ordering while removing expensive logsumexp, recovering acceptance compared with raw logits","rollback_reason":"topk_ms stayed low at 15.2ms but acceptance only recovered to 2.06, still requiring 16 steps; TPS 9.47 below best","next_action_hint":"the original logsumexp/row entropy term is important for tree depth ranking; any cheaper approximation needs an explicit depth/entropy penalty"}}
{"run":186,"commit":"de24439","metric":9.291117,"metrics":{"e2e_tps":1.260587,"spec_sec":25.385,"gen_tokens":32,"steps":15,"committed":34,"step_ms":229.61,"pack_ms":1.11,"draft_ms":156.59,"topk_ms":16.14,"exact_ms":55.73,"acceptance":2.267},"status":"discard","description":"top-k-only approximate logsumexp for proposal scores","timestamp":1777561666340,"segment":2,"confidence":6.926796845424066,"asi":{"hypothesis":"approximating logsumexp from only retained top-K logits may keep the row uncertainty penalty while avoiding full-vocab exp cost","rollback_reason":"topk_ms improved to 16ms, but acceptance dropped to 2.27 and draft_ms noise was high; TPS 9.29 is below best","next_action_hint":"top-K-only normalization is not close enough; the full-vocab tail mass affects DDTree depth ranking on this prompt"}}
{"run":187,"commit":"de24439","metric":10.548801,"metrics":{"e2e_tps":1.301766,"spec_sec":24.582,"gen_tokens":32,"steps":14,"committed":33,"step_ms":216.68,"pack_ms":1.12,"draft_ms":142.9,"topk_ms":14.74,"exact_ms":57.88,"acceptance":2.357},"status":"discard","description":"top-K-only normalization with larger budget 40 to recover acceptance","timestamp":1777561796176,"segment":2,"confidence":6.8563876878805425,"asi":{"hypothesis":"the cheap top-K-only logsumexp approximation saves about 5ms topk; increasing budget to 40 may recover the 14-step accepted path and beat the baseline","rollback_reason":"promising but TPS 10.55 was still just below kept 10.59, so not a primary improvement by the rules","next_action_hint":"repeat this exact combo (top-K-only normalization + budget 40) because it recovered acceptance and cut topk_ms to 14.7; a repeat may exceed the noisy best"}}
