{"run":143,"commit":"b4033f4","metric":9.697851,"metrics":{"acceptance":2.2,"committed":33,"draft_ms":145.8,"e2e_tps":1.295442,"exact_ms":53.86,"gen_tokens":32,"pack_ms":1.07,"spec_sec":24.702,"step_ms":219.98,"steps":15,"topk_ms":19.22},"status":"discard","description":"exact path with actual top_k=2 — acceptance drops to 2.20, requiring 15 steps","timestamp":1777550958043,"segment":2,"confidence":8.10071276246994,"asi":{"hypothesis":"actual top_k=2 may reduce overhead without losing too much acceptance","next_action_hint":"K=2 hurts acceptance (2.20 vs 2.36); K=4 matches K=8. Test K=4 again for confirmation.","note":"actual K=2: acceptance=2.20, steps=15, TPS=9.70; K=4 and K=8 both give 2.36/14 steps"}}
{"run":144,"commit":"74b01e6","metric":10.254438,"metrics":{"acceptance":2.357,"committed":33,"draft_ms":144.06,"e2e_tps":1.306389,"exact_ms":57.84,"gen_tokens":32,"pack_ms":1.11,"spec_sec":24.495,"step_ms":222.9,"steps":14,"topk_ms":19.86},"status":"keep","description":"exact path with actual top_k=4 — matches K=8 acceptance with less CPU work, new best TPS","timestamp":1777551092551,"segment":2,"confidence":8.160393835091734,"asi":{"hypothesis":"actual top_k=4 matches K=8 acceptance while using less CPU and memory for top-k extraction","next_action_hint":"K=4 is validated as equivalent to K=8 on this prompt; continue exploring other optimizations like exact-validation batching or server integration","note":"code changes for --ddtree-top-k flag and top_k parameter are now committed; K=4 acceptance=2.357, steps=14, TPS=10.25"}}
{"run":145,"commit":"74b01e6","metric":9.812038,"metrics":{"acceptance":2.357,"committed":33,"draft_ms":152.96,"e2e_tps":1.287208,"exact_ms":58.2,"gen_tokens":32,"pack_ms":1.1,"spec_sec":24.86,"step_ms":232.95,"steps":14,"topk_ms":20.65},"status":"discard","description":"repeat best config to check noise — draft time 153ms, TPS drops to 9.81","timestamp":1777551308662,"segment":2,"confidence":8.10071276246994,"asi":{"hypothesis":"repeat best config to establish noise floor","next_action_hint":"run one more repeat to confirm noise band, then try a different approach if no stable improvement is found","note":"draft_ms varies from 144ms to 153ms between runs; TPS range 9.8-10.3; noise floor is about 0.5 TPS","rollback_reason":"9.81 TPS below best of 10.25; within noise"}}
{"run":146,"commit":"6a23e9f","metric":0,"metrics":{"e2e_tps":0,"spec_sec":0,"gen_tokens":0,"steps":0,"committed":0,"step_ms":0,"pack_ms":0,"draft_ms":0,"topk_ms":0,"exact_ms":0,"acceptance":0},"status":"crash","description":"attempted repeat best config with inline env but harness rejected custom command form","timestamp":1777556393600,"segment":2,"confidence":8.10071276246994,"asi":{"hypothesis":"repeat pure best-first K=4 best config to confirm stability","rollback_reason":"run_experiment enforces direct ./autoresearch.sh invocation when autoresearch.sh exists and rejected inline environment assignment","next_action_hint":"temporarily edit autoresearch.sh defaults to the target config, then run exactly ./autoresearch.sh"}}
{"run":147,"commit":"6a23e9f","metric":0,"metrics":{"e2e_tps":0,"spec_sec":0,"gen_tokens":0,"steps":0,"committed":0,"step_ms":0,"pack_ms":0,"draft_ms":0,"topk_ms":0,"exact_ms":0,"acceptance":0},"status":"crash","description":"attempted direct script run with cd prefix but harness still rejected command form","timestamp":1777556433889,"segment":2,"confidence":8.10071276246994,"asi":{"hypothesis":"run ./autoresearch.sh after encoding best defaults in the script for repeat validation","rollback_reason":"run_experiment requires the command string to be exactly ./autoresearch.sh or bash autoresearch.sh; cd prefix is rejected","next_action_hint":"invoke run_experiment with command exactly ./autoresearch.sh and rely on harness working directory, or add a root-level wrapper only if exact command cannot find the script"}}
{"run":148,"commit":"de24439","metric":10.589855,"metrics":{"e2e_tps":1.303038,"spec_sec":24.558,"gen_tokens":32,"steps":14,"committed":33,"step_ms":215.84,"pack_ms":1.14,"draft_ms":137.23,"topk_ms":19.59,"exact_ms":57.84,"acceptance":2.357},"status":"keep","description":"repeat pure best-first K=4 defaults in autoresearch.sh — stable new best","timestamp":1777556713769,"segment":2,"confidence":8.160393835091734,"asi":{"hypothesis":"encoding the current best exact-path configuration as harness defaults and repeating pure best-first K=4 should confirm whether the 10.33 TPS run was stable","result":"repeat improved to 10.59 TPS with same 14-step acceptance pattern; draft_ms dropped to 137ms and exact_ms remained 57.8ms","next_action_hint":"use these defaults as the new baseline; next test whether budget can be reduced under pure best-first K=4, or validate on task761 to avoid overfitting"}}
{"run":149,"commit":"de24439","metric":9.866251,"metrics":{"e2e_tps":1.293086,"spec_sec":24.747,"gen_tokens":32,"steps":14,"committed":32,"step_ms":231.67,"pack_ms":1.13,"draft_ms":153.82,"topk_ms":20.37,"exact_ms":56.32,"acceptance":2.286},"status":"discard","description":"pure best-first K=4 with budget 28 — acceptance drops and draft time rises","timestamp":1777556801426,"segment":2,"confidence":8.10071276246994,"asi":{"hypothesis":"with pure best-first K=4, budget 28 might preserve the 14-step path while reducing draft/tree overhead versus budget 32","rollback_reason":"budget 28 lost one committed token, lowered acceptance to 2.286, and draft_ms increased to 153.8ms; primary TPS fell to 9.87 below the 10.59 best","next_action_hint":"do not reduce budget below 32 for this pure best-first config; test budget 36/40 only if looking for acceptance gains, or validate best defaults on a harder prompt"}}
{"run":150,"commit":"de24439","metric":10.244327,"metrics":{"e2e_tps":1.298807,"spec_sec":24.638,"gen_tokens":32,"steps":14,"committed":33,"step_ms":223.12,"pack_ms":1.12,"draft_ms":144.18,"topk_ms":20.05,"exact_ms":57.73,"acceptance":2.357},"status":"discard","description":"pure best-first K=4 with budget 36 — no acceptance gain over budget 32","timestamp":1777556896855,"segment":2,"confidence":8.160393835091734,"asi":{"hypothesis":"budget 36 may add useful branches under pure best-first K=4 and improve acceptance enough to offset extra overhead","rollback_reason":"budget 36 produced the same 14 steps, 33 committed tokens, and 2.357 acceptance as budget 32, while step_ms rose to 223ms and TPS fell to 10.24","next_action_hint":"budget 32 remains the sweet spot on this prompt; reset the harness default to 32 before further experiments"}}
{"run":151,"commit":"de24439","metric":9.803621,"metrics":{"e2e_tps":1.275815,"spec_sec":25.082,"gen_tokens":32,"steps":14,"committed":33,"step_ms":233.15,"pack_ms":0.98,"draft_ms":153.76,"topk_ms":20.33,"exact_ms":58.05,"acceptance":2.357},"status":"discard","description":"pure best-first K=4 with target_feat_ctx 112 — pack lower but draft slower","timestamp":1777556989888,"segment":2,"confidence":8.10071276246994,"asi":{"hypothesis":"target_feat_ctx 112 might lower feature packing and draft compute while pure best-first K=4 preserves the 14-step acceptance pattern","rollback_reason":"ctx112 kept acceptance but draft_ms rose to 153.8ms and step_ms to 233ms, dropping TPS to 9.80; the smaller pack cost did not translate to faster draft decode","next_action_hint":"keep target_feat_ctx 128; avoid further small-window tuning unless measuring multiple repeats or a different prompt"}}
{"run":152,"commit":"de24439","metric":9.751044,"metrics":{"e2e_tps":1.293086,"spec_sec":24.747,"gen_tokens":32,"steps":15,"committed":34,"step_ms":218.78,"pack_ms":1.09,"draft_ms":141.95,"topk_ms":20.11,"exact_ms":55.6,"acceptance":2.267},"status":"discard","description":"pure best-first K=4 with proposal_temp 0.5 — fewer accepted per step","timestamp":1777557081428,"segment":2,"confidence":8.586538754323378,"asi":{"hypothesis":"lower proposal_temp 0.5 may sharpen best-first scores and favor higher-confidence paths, possibly reducing exact validation work","rollback_reason":"temp 0.5 required 15 steps with acceptance 2.267 versus 14 steps at temp 0.7; lower per-step exact cost did not offset the extra step","next_action_hint":"keep proposal_temp 0.7; if sweeping temp, try slightly higher 0.85/1.0 rather than lower"}}
{"run":153,"commit":"de24439","metric":10.500824,"metrics":{"e2e_tps":1.308472,"spec_sec":24.456,"gen_tokens":32,"steps":14,"committed":33,"step_ms":217.67,"pack_ms":1.12,"draft_ms":138.2,"topk_ms":20.33,"exact_ms":57.98,"acceptance":2.357},"status":"discard","description":"pure best-first K=4 with proposal_temp 0.85 — close but below 0.7 best","timestamp":1777557170324,"segment":2,"confidence":8.10071276246994,"asi":{"hypothesis":"slightly higher proposal_temp 0.85 may diversify pure best-first branches without changing the 14-step acceptance pattern","rollback_reason":"temp 0.85 preserved acceptance and was fast, but TPS 10.50 remained below the kept 10.59 run at temp 0.7","next_action_hint":"0.7 and 0.85 are within noise; keep 0.7 as current best and test a structurally different knob such as tree row count or exact validation batching"}}
{"run":154,"commit":"de24439","metric":10.038712,"metrics":{"e2e_tps":1.290895,"spec_sec":24.789,"gen_tokens":32,"steps":14,"committed":33,"step_ms":227.69,"pack_ms":1.12,"draft_ms":147.82,"topk_ms":20.69,"exact_ms":58.03,"acceptance":2.357},"status":"discard","description":"reuse draft llama_batch across steps — allocation removal does not improve TPS","timestamp":1777557336806,"segment":2,"confidence":8.8935689439265,"asi":{"hypothesis":"allocating and freeing the draft embedding llama_batch every speculative step may add overhead or disturb allocator/cache behavior; reusing one batch should reduce draft-step overhead","rollback_reason":"reusing draft_batch passed correctness but TPS fell to 10.04 and draft_ms rose to 147.8ms; batch allocation is not a meaningful bottleneck or the result is noise below best","next_action_hint":"avoid micro-optimizing host batch allocation; focus on reducing draft llama_decode time, exact validation calls, or proposal acceptance"}}
{"run":155,"commit":"de24439","metric":10.016276,"metrics":{"e2e_tps":1.293191,"spec_sec":24.745,"gen_tokens":32,"steps":14,"committed":33,"step_ms":228.2,"pack_ms":1.12,"draft_ms":147.99,"topk_ms":21.17,"exact_ms":57.89,"acceptance":2.357},"status":"discard","description":"skip root draft logits output — fewer logits rows but no speedup","timestamp":1777557465323,"segment":2,"confidence":9.858464879449215,"asi":{"hypothesis":"the draft root position logits are unused; disabling logits for batch position 0 should reduce one vocab row of output materialization and top-k sync work","rollback_reason":"correctness passed, but TPS fell to 10.02 and topk_ms increased to 21.17ms; outputting one fewer row does not reduce the dominant GPU synchronization cost","next_action_hint":"do not pursue small logits-row reductions; a real top-k improvement likely needs GPU-side argmax/top-k or eliminating the sync"}}
{"run":156,"commit":"de24439","metric":10.259041,"metrics":{"e2e_tps":1.295861,"spec_sec":24.694,"gen_tokens":32,"steps":14,"committed":33,"step_ms":222.8,"pack_ms":1.12,"draft_ms":142.96,"topk_ms":20.67,"exact_ms":58.01,"acceptance":2.357},"status":"discard","description":"capped chain seed depth 4 with K=4 — no gain over pure best-first","timestamp":1777557573722,"segment":2,"confidence":9.583840128587989,"asi":{"hypothesis":"a short greedy-chain seed may keep early top-1 continuity while leaving most of the budget for best-first branches, combining benefits of chain_seed and pure best-first","rollback_reason":"chain_seed cap 4 produced the same acceptance as pure best-first but slower step_ms and 10.26 TPS, below the 10.59 best","next_action_hint":"pure best-first remains better; if revisiting chain caps, test only if cross-prompt acceptance requires it"}}
{"run":157,"commit":"de24439","metric":9.168135,"metrics":{"e2e_tps":1.262178,"spec_sec":25.353,"gen_tokens":32,"steps":15,"committed":34,"step_ms":232.69,"pack_ms":1.13,"draft_ms":154.03,"topk_ms":21.51,"exact_ms":55.98,"acceptance":2.267},"status":"discard","description":"n_batch/n_ubatch 256 exact path — acceptance pattern worsens and TPS drops","timestamp":1777557665480,"segment":2,"confidence":8.417775842329654,"asi":{"hypothesis":"reducing n_batch/n_ubatch from 512 to 256 may reduce buffer pressure and improve decode latency without affecting outputs","rollback_reason":"n_batch 256 changed the speculative path to 15 steps with lower acceptance and slower draft/topk timing; TPS fell to 9.17","next_action_hint":"keep n_batch/n_ubatch at 512 for the benchmark; do not reduce batch sizing unless targeting memory footprint rather than TPS"}}
{"run":158,"commit":"de24439","metric":0,"metrics":{"e2e_tps":0,"spec_sec":0,"gen_tokens":0,"steps":0,"committed":0,"step_ms":0,"pack_ms":0,"draft_ms":0,"topk_ms":0,"exact_ms":0,"acceptance":0},"status":"crash","description":"n_batch/n_ubatch 1024 exact path — target context OOM","timestamp":1777557702217,"segment":2,"confidence":8.417775842329654,"asi":{"hypothesis":"increasing n_batch/n_ubatch to 1024 may improve graph efficiency or decode scheduling compared with 512","rollback_reason":"context initialization failed allocating a 3.6 GiB CUDA compute buffer for 1024-token graph reserve; no benchmark metrics produced","next_action_hint":"512 is the practical upper bound on the 24GB Castle GPU for this configuration; reset n_batch/n_ubatch to 512"}}
{"run":159,"commit":"de24439","metric":9.87179,"metrics":{"e2e_tps":1.293923,"spec_sec":24.731,"gen_tokens":32,"steps":14,"committed":33,"step_ms":231.54,"pack_ms":1.11,"draft_ms":151.29,"topk_ms":20.99,"exact_ms":58.12,"acceptance":2.357},"status":"discard","description":"reuse 1-token target validation batch — no host allocation speedup","timestamp":1777557879589,"segment":2,"confidence":8.8935689439265,"asi":{"hypothesis":"exact chain validation allocates a 1-token llama_batch for every validated node; reusing one batch may reduce per-step host overhead","rollback_reason":"reusable target batch passed correctness but TPS fell to 9.87 and exact_ms stayed ~58ms; target llama_decode dominates, not batch allocation","next_action_hint":"stop pursuing host allocation micro-optimizations; focus on reducing number of target validation decodes or draft GPU compute"}}
{"run":160,"commit":"de24439","metric":9.727272,"metrics":{"e2e_tps":1.286174,"spec_sec":24.88,"gen_tokens":32,"steps":14,"committed":33,"step_ms":234.98,"pack_ms":1.12,"draft_ms":155.15,"topk_ms":20.47,"exact_ms":58.22,"acceptance":2.357},"status":"discard","description":"pure best-first actual top_k=3 — same acceptance but slower timing","timestamp":1777557966866,"segment":2,"confidence":9.426370246854823,"asi":{"hypothesis":"K=3 may preserve the K=4 acceptance path while slightly reducing top-k work and tree branching","rollback_reason":"K=3 kept the 14-step acceptance pattern but draft/step timing was worse and TPS fell to 9.73; K=4 remains the best tested K above the K=2 acceptance cliff","next_action_hint":"keep top_k=4; K changes mostly affect acceptance, not the ~20ms sync-bound top-k cost"}}
{"run":161,"commit":"de24439","metric":9.447052,"metrics":{"e2e_tps":1.282977,"spec_sec":24.942,"gen_tokens":32,"steps":14,"committed":33,"step_ms":241.95,"pack_ms":1.13,"draft_ms":159.54,"topk_ms":22.89,"exact_ms":58.35,"acceptance":2.357},"status":"discard","description":"pure best-first K=4 with proposal_temp 1.0 — same acceptance but much slower","timestamp":1777558057033,"segment":2,"confidence":8.586538754323378,"asi":{"hypothesis":"proposal_temp 1.0 may diversify branch scores more than 0.7 and improve path quality","rollback_reason":"temp 1.0 did not improve acceptance and produced much slower draft/topk timing, dropping TPS to 9.45","next_action_hint":"keep proposal_temp 0.7; higher temperatures above 0.85 are not useful on this prompt"}}
{"run":162,"commit":"de24439","metric":10.433717,"metrics":{"e2e_tps":1.297806,"spec_sec":24.657,"gen_tokens":32,"steps":14,"committed":33,"step_ms":219.07,"pack_ms":1.13,"draft_ms":140.33,"topk_ms":19.74,"exact_ms":57.83,"acceptance":2.357},"status":"discard","description":"pure best-first K=4 with block_size 12 — close but below block_size 16 best","timestamp":1777558168159,"segment":2,"confidence":8.10071276246994,"asi":{"hypothesis":"block_size 12 may reduce draft work while retaining the same accepted path under pure best-first K=4","rollback_reason":"block_size 12 preserved acceptance and was faster than many noisy runs, but TPS 10.43 stayed below the kept 10.59 block_size 16 baseline","next_action_hint":"block_size 12 is close enough to revisit with repeats only if the 10.59 baseline proves noisy; for now keep default block_size 16"}}
{"run":163,"commit":"de24439","metric":9.508358,"metrics":{"e2e_tps":1.284934,"spec_sec":24.904,"gen_tokens":32,"steps":14,"committed":33,"step_ms":240.39,"pack_ms":1.12,"draft_ms":159.02,"topk_ms":22.22,"exact_ms":58,"acceptance":2.357},"status":"discard","description":"repeat current best defaults after sweep — noisy low baseline repeat","timestamp":1777558253018,"segment":2,"confidence":7.901161640801124,"asi":{"hypothesis":"repeat the current best defaults after restoring block_size 16 to measure noise and ensure the harness is back on the kept config","rollback_reason":"repeat preserved correctness and acceptance but landed in a slow-noise band at 9.51 TPS, below the 10.59 kept best","next_action_hint":"the metric is noisy with draft_ms spanning ~137-159ms; future keeps should be repeated, and block_size 12/0.85 temp close calls should not be kept without repeated wins"}}
{"run":164,"commit":"de24439","metric":10.074996,"metrics":{"e2e_tps":1.299123,"spec_sec":24.632,"gen_tokens":32,"steps":14,"committed":33,"step_ms":226.87,"pack_ms":1.11,"draft_ms":147.9,"topk_ms":20.15,"exact_ms":57.67,"acceptance":2.357},"status":"discard","description":"repeat current best defaults while refocusing on draft decode","timestamp":1777559045624,"segment":2,"confidence":8.10071276246994,"asi":{"hypothesis":"repeat current best pure best-first K=4 baseline to measure the current draft_ms noise band before changing draft decode","rollback_reason":"baseline repeat did not beat kept 10.59 TPS; no code/config change to keep","next_action_hint":"use draft_ms around 148ms as current reference; inspect full log for dflash_draft_ubatch_timing compute vs set_inputs breakdown"}}
{"run":165,"commit":"de24439","metric":9.79312,"metrics":{"e2e_tps":1.298122,"spec_sec":24.651,"gen_tokens":32,"steps":14,"committed":33,"step_ms":233.4,"pack_ms":1.13,"draft_ms":154,"topk_ms":20.15,"exact_ms":58.09,"acceptance":2.357},"status":"discard","description":"repeat block_size 12 draft decode optimization candidate","timestamp":1777559136372,"segment":2,"confidence":8.586538754323378,"asi":{"hypothesis":"block_size 12 may reduce draft graph work while preserving the same 14-step acceptance path, improving draft decode","rollback_reason":"repeat was slower: draft_ms 154ms and TPS 9.79, below kept block_size 16 best","next_action_hint":"do not keep block_size 12; draft compute does not scale down reliably with fewer block tokens"}}
{"run":166,"commit":"de24439","metric":8.835483,"metrics":{"e2e_tps":1.263923,"spec_sec":25.318,"gen_tokens":32,"steps":16,"committed":33,"step_ms":226.36,"pack_ms":0.82,"draft_ms":152.98,"topk_ms":21.5,"exact_ms":51.03,"acceptance":2.062},"status":"discard","description":"pure best-first K=4 with target_feat_ctx 96 to reduce draft FC/attention context","timestamp":1777559283158,"segment":2,"confidence":7.884112887310015,"asi":{"hypothesis":"shrinking target_feat_ctx from 128 to 96 should reduce draft target_feat FC/attention work enough to offset any small acceptance loss","rollback_reason":"ctx96 reduced pack only; draft_ms rose to 153ms and acceptance fell to 2.06, requiring 16 steps and lowering TPS to 8.84","next_action_hint":"target feature context below 128 damages proposal quality and does not reduce draft compute in practice; keep ctx128"}}
{"run":167,"commit":"de24439","metric":8.609927,"metrics":{"e2e_tps":1.273125,"spec_sec":25.135,"gen_tokens":32,"steps":16,"committed":33,"step_ms":232.29,"pack_ms":0.83,"draft_ms":158.47,"topk_ms":22.05,"exact_ms":50.9,"acceptance":2.062},"status":"discard","description":"F16 target_feat_raw draft input under accidental ctx96 — slower and lower acceptance","timestamp":1777559419904,"segment":2,"confidence":7.637615029697407,"asi":{"hypothesis":"using F16 target_feat_raw may reduce draft input bandwidth and FC compute cost","rollback_reason":"run used ctx96 left in autoresearch.sh from the previous config experiment, and F16 input was slower with lower acceptance; not a valid improvement","next_action_hint":"restore autoresearch.sh target_feat_ctx default to 128 before retrying any target_feat format experiment; be aware log_experiment preserves autoresearch.sh changes"}}
{"run":168,"commit":"de24439","metric":10.134408,"metrics":{"e2e_tps":1.297175,"spec_sec":24.669,"gen_tokens":32,"steps":14,"committed":33,"step_ms":225.54,"pack_ms":1.13,"draft_ms":146.19,"topk_ms":20.52,"exact_ms":57.67,"acceptance":2.357},"status":"discard","description":"F16 target_feat_raw draft input at ctx128","timestamp":1777559542537,"segment":2,"confidence":7.884112887310015,"asi":{"hypothesis":"using F16 target_feat_raw at the draft graph input should cut target_feat upload bandwidth and may speed the FC projection without changing exact correctness","rollback_reason":"correctness passed but TPS 10.13 stayed below kept 10.59 and draft_ms 146ms is within normal baseline noise; CPU F32→F16 conversion plus F16 input did not produce a real speedup","next_action_hint":"do not change target_feat_raw to F16 via host conversion; if revisiting, capture/pack directly in F16 or move compression to GPU to avoid CPU conversion cost"}}
