{"run":28,"commit":"c2c95e3","metric":0,"metrics":{"tps":0,"e2e_tps":0,"spec_sec":21.704,"gen_tokens":0,"steps":1,"committed":0,"step_ms":0,"pack_ms":3.52,"draft_ms":279.6,"topk_ms":16.26,"exact_ms":0,"exact_decode_ms":0,"acceptance":0},"status":"crash","description":"fast rollback with draft GPU layers 4 still OOMs persist","timestamp":1777496939181,"segment":1,"confidence":11.829481672771372,"asi":{"hypothesis":"offloading fewer draft layers may free VRAM for fast rollback persist while retaining enough draft speed","rollback_reason":"ngld4 still failed 1707.75 MiB persist allocation and draft time already rose to 280 ms","next_action_hint":"if testing persist-fit, drop to ngld3 or lower, but expected draft slowdown likely outweighs rollback savings"}}
{"run":29,"commit":"c2c95e3","metric":4.278956,"metrics":{"tps":4.278956,"e2e_tps":1.114323,"spec_sec":28.717,"gen_tokens":32,"steps":18,"committed":33,"step_ms":415.47,"pack_ms":1.09,"draft_ms":294.24,"topk_ms":17.17,"exact_ms":0,"exact_decode_ms":0,"acceptance":1.833},"status":"discard","description":"fast rollback with draft GPU layers 3 fits but is slower than exact path","timestamp":1777497015792,"segment":1,"confidence":11.723927501915169,"asi":{"hypothesis":"ngld3 may free enough VRAM for fast rollback and remove exact decode cost","rollback_reason":"persist fit and exact cost dropped to zero, but draft slowed to 294 ms and target_tree/rollback path made step 415 ms; TPS far below exact default","next_action_hint":"do not trade draft GPU layers for fast rollback on 64k; full draft GPU exact path is better"}}
{"run":30,"commit":"c2c95e3","metric":8.740901,"metrics":{"tps":8.740901,"e2e_tps":1.289127,"spec_sec":24.823,"gen_tokens":32,"steps":17,"committed":33,"step_ms":215.35,"pack_ms":1.07,"draft_ms":147.03,"topk_ms":19.45,"exact_ms":47.77,"exact_decode_ms":0,"acceptance":1.941},"status":"discard","description":"benchmark 32k context for 20k prompt with 128 default","timestamp":1777497087757,"segment":1,"confidence":11.620240385859825,"asi":{"hypothesis":"if the prompt fits under 32k, lower target context may reduce memory/compute overhead versus 64k","rollback_reason":"32k context was above baseline but below the 64k 128-window best; no primary improvement in this e2e workload","next_action_hint":"context reduction may still help server prefill/memory, but decode step optimization should focus elsewhere"}}
{"run":31,"commit":"c2c95e3","metric":8.538297,"metrics":{"tps":8.538297,"e2e_tps":1.284779,"spec_sec":24.907,"gen_tokens":32,"steps":17,"committed":33,"step_ms":220.46,"pack_ms":1.09,"draft_ms":151.06,"topk_ms":20.14,"exact_ms":48.13,"exact_decode_ms":0,"acceptance":1.941},"status":"discard","description":"benchmark 24k context for 20k prompt","timestamp":1777497161415,"segment":1,"confidence":11.723927501915169,"asi":{"hypothesis":"context just above prompt length may reduce decode overhead further than 32k/64k","rollback_reason":"decode TPS below current best; smaller n_ctx did not improve step time on this harness","next_action_hint":"do not spend more iterations on n_ctx for decode TPS; use n_ctx tuning only for memory/server fit"}}
{"run":32,"commit":"c2c95e3","metric":0,"metrics":{"tps":0,"e2e_tps":0,"spec_sec":21.44,"gen_tokens":0,"steps":1,"committed":0,"step_ms":0,"pack_ms":3.54,"draft_ms":146.12,"topk_ms":20.51,"exact_ms":0,"exact_decode_ms":0,"acceptance":0},"status":"crash","description":"smaller draft context plus full-draft fast rollback still OOMs persist","timestamp":1777497248234,"segment":1,"confidence":11.723927501915169,"asi":{"hypothesis":"sizing draft n_ctx to the 128 target-feature window may free enough compute-buffer VRAM for full-draft fast rollback","rollback_reason":"fast rollback still failed persist allocation and returned empty output with snapshot fallback disabled","next_action_hint":"draft context sizing alone does not free the required 1.7 GiB; persist compression is needed for this route"}}
{"run":33,"commit":"c2c95e3","metric":8.497057,"metrics":{"tps":8.497057,"e2e_tps":1.266474,"spec_sec":25.267,"gen_tokens":32,"steps":17,"committed":33,"step_ms":221.53,"pack_ms":1.07,"draft_ms":153.17,"topk_ms":19.25,"exact_ms":48.01,"exact_decode_ms":0,"acceptance":1.941},"status":"discard","description":"skip exact validation seq_rm diagnostic","timestamp":1777497395516,"segment":1,"confidence":11.854680691870985,"asi":{"hypothesis":"default exact chain validation may be clearing an already-empty future range every step; skipping it could save overhead","rollback_reason":"correctness passed but primary TPS dropped; seq_rm is not a meaningful bottleneck","next_action_hint":"keep the safety clear in exact validation"}}
{"run":34,"commit":"c2c95e3","metric":2.679353,"metrics":{"tps":2.679353,"e2e_tps":0.960384,"spec_sec":33.32,"gen_tokens":32,"steps":17,"committed":33,"step_ms":702.54,"pack_ms":1.11,"draft_ms":160.23,"topk_ms":19.65,"exact_ms":0,"exact_decode_ms":0,"acceptance":1.941},"status":"discard","description":"fast-batched with snapshot/replay fallback under 128 default","timestamp":1777497492163,"segment":1,"confidence":11.723927501915169,"asi":{"hypothesis":"trusting batched posterior with snapshot fallback might avoid exact decode while preserving correctness","rollback_reason":"snapshot/tree/replay path made step time 702 ms, far slower than exact chain default; fast-batched without persist rollback is not viable","next_action_hint":"only revisit fast-batched with a no-OOM fast rollback or conditional exact rule; snapshot fallback is too expensive"}}
{"run":35,"commit":"c2c95e3","metric":8.402611,"metrics":{"tps":8.402611,"e2e_tps":1.269942,"spec_sec":25.198,"gen_tokens":32,"steps":17,"committed":33,"step_ms":224.02,"pack_ms":1.09,"draft_ms":154.23,"topk_ms":20.73,"exact_ms":47.95,"exact_decode_ms":0,"acceptance":1.941},"status":"discard","description":"benchmark n_batch 2048 with 512 ubatch","timestamp":1777497577065,"segment":1,"confidence":11.829481672771372,"asi":{"hypothesis":"larger prompt batch may improve prefill or reserve behavior without changing decode acceptance","rollback_reason":"decode step time worsened; n_batch tuning is not a decode TPS improvement","next_action_hint":"keep n_batch=512 for this e2e benchmark unless optimizing prompt prefill separately"}}
{"run":36,"commit":"c2c95e3","metric":8.610159,"metrics":{"tps":8.610159,"e2e_tps":1.233046,"spec_sec":25.952,"gen_tokens":32,"steps":17,"committed":33,"step_ms":218.62,"pack_ms":1.06,"draft_ms":149.81,"topk_ms":19.88,"exact_ms":47.83,"exact_decode_ms":0,"acceptance":1.941},"status":"discard","description":"benchmark n_ubatch 256","timestamp":1777497653606,"segment":1,"confidence":12.65478788505223,"asi":{"hypothesis":"smaller ubatch may reduce memory pressure or improve graph reserve for decode","rollback_reason":"primary TPS below best and e2e time worsened due slower prompt processing; no decode win","next_action_hint":"do not tune ubatch for current decode target"}}
{"run":37,"commit":"c2c95e3","metric":8.817054,"metrics":{"tps":8.817054,"e2e_tps":1.209327,"spec_sec":26.461,"gen_tokens":32,"steps":17,"committed":33,"step_ms":213.49,"pack_ms":1.09,"draft_ms":145.34,"topk_ms":18.88,"exact_ms":48.15,"exact_decode_ms":47.76,"acceptance":1.941},"status":"discard","description":"print exact validation timing split in e2e harness","timestamp":1777497756241,"segment":1,"confidence":11.854680691870985,"asi":{"hypothesis":"surface exact_decode/exact_sample timing in e2e to guide next optimization decisions","rollback_reason":"instrumentation did not improve primary TPS and was reverted by experiment rules, though it confirmed exact_decode is essentially all exact cost","next_action_hint":"if more diagnostics are needed, re-add exact split intentionally; current useful fact: exact_decode 47.76 ms of exact 48.15 ms"}}
{"run":38,"commit":"c2c95e3","metric":7.97639,"metrics":{"tps":7.97639,"e2e_tps":1.251418,"spec_sec":25.571,"gen_tokens":32,"steps":18,"committed":33,"step_ms":222.88,"pack_ms":0.94,"draft_ms":156.66,"topk_ms":19.89,"exact_ms":45.36,"exact_decode_ms":0,"acceptance":1.833},"status":"discard","description":"benchmark target feature window 112","timestamp":1777497962865,"segment":1,"confidence":11.723927501915169,"asi":{"hypothesis":"112-token window might reduce draft context below 128 without dropping acceptance","rollback_reason":"acceptance dropped to 1.83 and an extra step was needed; 128 remains better","next_action_hint":"avoid target feature windows below 128 on this prompt"}}
{"run":39,"commit":"c2c95e3","metric":8.508964,"metrics":{"tps":8.508964,"e2e_tps":1.272163,"spec_sec":25.154,"gen_tokens":32,"steps":17,"committed":33,"step_ms":221.22,"pack_ms":1.21,"draft_ms":151.9,"topk_ms":20.01,"exact_ms":48.07,"exact_decode_ms":0,"acceptance":1.941},"status":"discard","description":"benchmark target feature window 144","timestamp":1777498045067,"segment":1,"confidence":11.854680691870985,"asi":{"hypothesis":"144-token window may be a safer slightly larger default than 128 with similar acceptance","rollback_reason":"acceptance matched 128 but draft/step time was worse and primary TPS below best","next_action_hint":"128 is still the best target feature default among tested windows"}}
{"run":40,"commit":"c2c95e3","metric":0,"metrics":{"tps":0,"e2e_tps":0,"spec_sec":33.226,"gen_tokens":32,"steps":32,"committed":32,"step_ms":212.78,"pack_ms":1.02,"draft_ms":160.08,"topk_ms":21.43,"exact_ms":30.22,"exact_decode_ms":0,"acceptance":1},"status":"crash","description":"tq3_0 KV exact default diverges from chain in e2e","timestamp":1777498174420,"segment":1,"confidence":11.854680691870985,"asi":{"hypothesis":"TQ3 KV may reduce memory or improve speed in exact default mode after adding e2e parser support","rollback_reason":"correctness failed at first generated token: chain[0]=8635, spec[0]=248069; TQ3 is not a safe drop-in for this correctness gate","next_action_hint":"do not use tq3_0 for DDTree correctness until target-only chain/spec equivalence is debugged"}}
{"run":41,"commit":"c2c95e3","metric":0,"metrics":{"tps":0,"e2e_tps":0,"spec_sec":0,"gen_tokens":0,"steps":0,"committed":0,"step_ms":0,"pack_ms":0,"draft_ms":0,"topk_ms":0,"exact_ms":0,"exact_decode_ms":0,"acceptance":0},"status":"crash","description":"q8 KV exact default OOMs with full draft at 64k","timestamp":1777498231508,"segment":1,"confidence":11.854680691870985,"asi":{"hypothesis":"q8 KV might speed exact decode enough to offset larger memory footprint","rollback_reason":"q8_0 KV caused draft context compute buffer allocation OOM with -ngl65 -ngld6 -c65536","next_action_hint":"q4_0 remains the viable full-draft 64k KV type on this GPU"}}
{"run":42,"commit":"c2c95e3","metric":9.049339,"metrics":{"tps":9.049339,"e2e_tps":1.28726,"spec_sec":24.859,"gen_tokens":32,"steps":17,"committed":33,"step_ms":208.01,"pack_ms":1.07,"draft_ms":140.46,"topk_ms":19.16,"exact_ms":47.28,"exact_decode_ms":0,"acceptance":1.941},"status":"discard","description":"q8 KV with 32k context fits and nearly matches best","timestamp":1777498306731,"segment":1,"confidence":11.723927501915169,"asi":{"hypothesis":"for prompts fitting 32k, q8 KV may fit and speed decode compared with q4 at 64k","rollback_reason":"q8_0 + 32k was close but still below the 64k q4 best run, so no primary improvement","next_action_hint":"q8_0 + 32k is a viable alternative for <=32k prompts; retest with server/prompt-prefill metric if memory quality matters"}}
{"run":43,"commit":"c2c95e3","metric":8.663259,"metrics":{"tps":8.663259,"e2e_tps":1.277853,"spec_sec":25.042,"gen_tokens":32,"steps":17,"committed":33,"step_ms":217.28,"pack_ms":1.07,"draft_ms":148.82,"topk_ms":19.59,"exact_ms":47.76,"exact_decode_ms":0,"acceptance":1.941},"status":"discard","description":"repeat q8 KV with 32k context","timestamp":1777498380449,"segment":1,"confidence":12.711493900280791,"asi":{"hypothesis":"confirm whether q8_0 + 32k close-to-best run was stable","rollback_reason":"repeat fell to 8.66 TPS, confirming the 9.05 run was noise/near-best but not better than 64k q4 default","next_action_hint":"do not switch primary config to q8_0 + 32k for decode TPS"}}
{"run":44,"commit":"c2c95e3","metric":8.561987,"metrics":{"tps":8.561987,"e2e_tps":1.273987,"spec_sec":25.118,"gen_tokens":32,"steps":17,"committed":33,"step_ms":219.85,"pack_ms":1.04,"draft_ms":150.19,"topk_ms":20.4,"exact_ms":48.2,"exact_decode_ms":0,"acceptance":1.941},"status":"discard","description":"benchmark target feature window 124","timestamp":1777498457519,"segment":1,"confidence":14.22995076181824,"asi":{"hypothesis":"124 may be just below 128 while preserving acceptance","rollback_reason":"acceptance preserved but step time was worse than 128 default; no primary improvement","next_action_hint":"stop fine-tuning target feature window around 128"}}
{"run":45,"commit":"c2c95e3","metric":5.277915,"metrics":{"tps":5.277915,"e2e_tps":1.165883,"spec_sec":27.447,"gen_tokens":32,"steps":30,"committed":32,"step_ms":202.1,"pack_ms":1,"draft_ms":153.89,"topk_ms":20.42,"exact_ms":26.76,"exact_decode_ms":0,"acceptance":1.067},"status":"discard","description":"do not request draft logits for root slot","timestamp":1777498552553,"segment":1,"confidence":12.711493900280791,"asi":{"hypothesis":"skip unused root-position draft logits to reduce lm_head/output work by one row per draft step","rollback_reason":"correctness remained bit-equal only because exact validation fell back, but draft proposal quality collapsed: acceptance 1.94->1.07 and steps 17->30; logits row indexing/output semantics do not support this simple change","next_action_hint":"do not skip root logits without first understanding llama_get_logits_ith output indexing for sparse logits flags"}}
{"run":46,"commit":"c2c95e3","metric":8.607403,"metrics":{"tps":8.607403,"e2e_tps":1.272113,"spec_sec":25.155,"gen_tokens":32,"steps":17,"committed":33,"step_ms":218.69,"pack_ms":1.07,"draft_ms":148.88,"topk_ms":20.44,"exact_ms":48.27,"exact_decode_ms":0,"acceptance":1.941},"status":"discard","description":"suppress root logits flag but keep original logits row indexing","timestamp":1777498637976,"segment":1,"confidence":14.22995076181824,"asi":{"hypothesis":"root logits can be disabled while keeping llama_get_logits_ith(1) indexing, reducing output work without changing proposals","rollback_reason":"proposal quality stayed intact but draft/topk/step time did not improve enough; primary below best","next_action_hint":"root logits flag is not a useful optimization in current llama.cpp output path"}}
{"run":47,"commit":"c2c95e3","metric":0,"metrics":{"tps":0,"e2e_tps":0,"spec_sec":0,"gen_tokens":0,"steps":0,"committed":0,"step_ms":0,"pack_ms":0,"draft_ms":0,"topk_ms":0,"exact_ms":0,"exact_decode_ms":0,"acceptance":0},"status":"crash","description":"disable Flash Attention diagnostic with q4 KV","timestamp":1777498814939,"segment":1,"confidence":14.22995076181824,"asi":{"hypothesis":"small one-token exact decode and draft attention might be faster without Flash Attention overhead","rollback_reason":"q4_0 V cache quantization requires flash_attn, so target context creation failed before benchmark","next_action_hint":"only test no-flash with f16 KV if memory allows; q4/q8 quantized V requires Flash Attention"}}
{"run":48,"commit":"c2c95e3","metric":0,"metrics":{"tps":0,"e2e_tps":0,"spec_sec":0,"gen_tokens":0,"steps":0,"committed":0,"step_ms":0,"pack_ms":0,"draft_ms":0,"topk_ms":0,"exact_ms":0,"exact_decode_ms":0,"acceptance":0},"status":"crash","description":"no-flash with f16 KV at 32k OOMs target compute buffer","timestamp":1777498859775,"segment":1,"confidence":14.22995076181824,"asi":{"hypothesis":"use f16 KV at 32k to allow no-flash attention and test whether one-token decode is faster without Flash Attention","rollback_reason":"context creation failed allocating 1739 MiB CUDA compute buffer; no benchmark ran","next_action_hint":"no-flash is not viable in current full-offload/full-draft memory envelope; abandon this path"}}
{"run":49,"commit":"c2c95e3","metric":8.674837,"metrics":{"tps":8.674837,"e2e_tps":1.274088,"spec_sec":25.116,"gen_tokens":32,"steps":17,"committed":33,"step_ms":216.99,"pack_ms":1.08,"draft_ms":146.47,"topk_ms":20.99,"exact_ms":48.42,"exact_decode_ms":0,"acceptance":1.941},"status":"discard","description":"force chain recurrent kernel diagnostic","timestamp":1777498962837,"segment":1,"confidence":16.05291169266154,"asi":{"hypothesis":"forcing chain recurrent kernels might reduce exact one-token decode overhead or avoid tree-kernel dispatch cost in exact validation","rollback_reason":"correctness passed but step time stayed below best; exact remained about 48 ms and topk worsened","next_action_hint":"leave chain-kernel force unset for normal runs"}}
{"run":50,"commit":"c2c95e3","metric":8.605435,"metrics":{"tps":8.605435,"e2e_tps":1.275154,"spec_sec":25.095,"gen_tokens":32,"steps":17,"committed":33,"step_ms":218.74,"pack_ms":0.73,"draft_ms":150.02,"topk_ms":19.64,"exact_ms":48.32,"exact_decode_ms":0,"acceptance":1.941},"status":"discard","description":"bulk-copy contiguous spans when packing target feature ring","timestamp":1777499134443,"segment":1,"confidence":16.106475474044874,"asi":{"hypothesis":"replace per-column target_feat ring packing with one or two bulk memcpy calls to reduce the remaining pack/upload overhead without changing model behavior","rollback_reason":"pack time improved from about 1.06 ms to 0.73 ms, but total step time and primary TPS stayed below the 128-window best; pack is now too small to move throughput alone","next_action_hint":"do not spend more iterations on CPU ring packing until larger draft/exact decode bottlenecks are addressed"}}
{"run":51,"commit":"c2c95e3","metric":8.567053,"metrics":{"tps":8.567053,"e2e_tps":1.269287,"spec_sec":25.211,"gen_tokens":32,"steps":17,"committed":33,"step_ms":219.72,"pack_ms":1.09,"draft_ms":151.19,"topk_ms":19.48,"exact_ms":47.93,"exact_decode_ms":0,"acceptance":1.941},"status":"discard","description":"allow DFlash target_feat graph input to reuse draft graph","timestamp":1777499394932,"segment":1,"confidence":18.011796096054017,"asi":{"hypothesis":"DFlash draft graph was not reused because target_feat input lacked can_reuse; allowing reuse should stabilize CUDA graph/build and reduce draft overhead without changing math","rollback_reason":"graph reuse worked after the first step (reused=1, build_alloc=0) but primary TPS and draft_ms were worse than the 128-window best; graph rebuild cost was not a bottleneck","next_action_hint":"do not prioritize graph reuse; focus on actual draft compute (fc/attention/lm_head) or exact target decode"}}
{"run":52,"commit":"c2c95e3","metric":0,"metrics":{"tps":0,"e2e_tps":0,"spec_sec":21.679,"gen_tokens":0,"steps":1,"committed":0,"step_ms":0,"pack_ms":3.62,"draft_ms":154.37,"topk_ms":18.85,"exact_ms":0,"exact_decode_ms":0,"acceptance":0},"status":"crash","description":"fast rollback with budget 14 to reduce persist footprint","timestamp":1777499530631,"segment":1,"confidence":18.011796096054017,"asi":{"hypothesis":"lowering DDTree budget from 22 to 14 reduces persist allocation from about 1.7 GiB to about 1.1 GiB and may allow full-draft fast rollback at 64k","rollback_reason":"persist allocation still OOMed at 1086.75 MiB; driver produced empty output with snapshot fallback disabled","next_action_hint":"full-draft fast rollback needs more than budget reduction; try lower target/draft compute buffers only if expected target_tree cost can still beat exact chain"}}
{"run":53,"commit":"c2c95e3","metric":7.570506,"metrics":{"tps":7.570506,"e2e_tps":1.246834,"spec_sec":25.665,"gen_tokens":32,"steps":19,"committed":34,"step_ms":222.47,"pack_ms":1.05,"draft_ms":154.78,"topk_ms":22.6,"exact_ms":43.99,"exact_decode_ms":0,"acceptance":1.789},"status":"discard","description":"diagnostic larger draft block size 24","timestamp":1777499663146,"segment":1,"confidence":16.106475474044874,"asi":{"hypothesis":"increasing DDTree draft block size beyond the trained/default 16 may expose a longer proposal horizon and reduce exact validation steps without changing correctness because exact validation remains authoritative","rollback_reason":"block size 24 passed bit-equal correctness but acceptance dropped to 1.79, steps rose to 19, and topk/draft costs increased; primary TPS below best","next_action_hint":"do not increase DFlash block size above 16 for this model; the draft quality beyond the default horizon is worse"}}
{"run":54,"commit":"abe969d","metric":9.820771,"metrics":{"tps":9.820771,"e2e_tps":1.295075,"spec_sec":24.709,"gen_tokens":32,"steps":16,"committed":33,"step_ms":203.65,"pack_ms":1.08,"draft_ms":134.43,"topk_ms":17.84,"exact_ms":50.27,"exact_decode_ms":0,"acceptance":2.062},"status":"keep","description":"increase DDTree budget to 32 for exact-validation path","timestamp":1777499764379,"segment":1,"confidence":19.93149922357974,"asi":{"hypothesis":"larger DDTree budget may include more alternative draft branches so exact chain validation can accept farther before falling off the proposal tree; top-k cost should stay similar because K remains 8","result":"budget 32 improved decode TPS to 9.82, reduced steps 17->16, and raised acceptance to 2.06 despite exact_ms rising per step","next_action_hint":"confirm with repeat and test budget 40/48; watch for prompt overfit because larger budgets may help only when alternate branches match the exact path"}}
