{"type":"config","name":"Optimize DFlash DDTree TPS on Castle","metricName":"tps","metricUnit":"","bestDirection":"higher"}
{"run":1,"commit":"b63fd0d","metric":0,"metrics":{"tps":0},"status":"crash","description":"baseline harness failed before benchmark during sync/ssh setup","timestamp":1777494462566,"segment":0,"confidence":null,"asi":{"hypothesis":"establish Castle e2e baseline using local-to-remote sync and CUDA harness","rollback_reason":"script exited with ssh/rsync code 255 before producing output","next_action_hint":"debug autoresearch.sh sync command; likely rsync invoking ssh differently than direct ssh"}}
{"run":2,"commit":"b63fd0d","metric":0,"metrics":{"tps":0},"status":"crash","description":"baseline harness failed due shell quoting in remote kill command","timestamp":1777494502610,"segment":0,"confidence":null,"asi":{"hypothesis":"fix pkill self-termination in Castle benchmark harness","rollback_reason":"bash expanded $1 locally under set -u in the awk kill snippet","next_action_hint":"escape awk field as \\$1 or avoid awk entirely with pgrep pattern"}}
{"run":3,"commit":"0374171","metric":0.665751,"metrics":{"tps":0.665751,"spec_sec":24.033,"gen_tokens":16,"steps":9,"committed":0,"step_ms":282.13,"pack_ms":10.25,"draft_ms":203.26,"topk_ms":20.85,"exact_ms":47.73,"exact_decode_ms":0,"acceptance":1.889},"status":"keep","description":"baseline Castle e2e chain-only DDTree benchmark with 1024 target feature window","timestamp":1777494603864,"segment":0,"confidence":null,"asi":{"hypothesis":"establish baseline using current stable chain-only exact validation, full target/draft GPU offload, q4 KV, 64k ctx, real rendered prompt","benchmark":"./autoresearch.sh on Castle; gen=16; prompt=/tmp/real_rendered_prompt.txt; LLAMA_DDTREE_TARGET_FEAT_CTX=1024","note":"committed parser returned 0 likely due regex choosing absent/overwritten field; acceptance parsed from e2e output is the useful commit-rate signal"}}
{"type":"config","name":"Optimize DFlash DDTree decode TPS on Castle","metricName":"tps","metricUnit":"","bestDirection":"higher"}
{"run":4,"commit":"6510b31","metric":6.419361,"metrics":{"tps":6.419361,"e2e_tps":1.197874,"spec_sec":26.714,"gen_tokens":32,"steps":18,"committed":0,"step_ms":276.94,"pack_ms":8.88,"draft_ms":201.75,"topk_ms":20.64,"exact_ms":45.63,"exact_decode_ms":0,"acceptance":1.833},"status":"keep","description":"decode-TPS baseline with gen32 after fixing primary metric to exclude prompt/model overhead","timestamp":1777494737663,"segment":1,"confidence":null,"asi":{"hypothesis":"use decode-only TPS as the primary metric because current optimization target is per-step decode cost, not prompt prefill/model load","benchmark":"Castle e2e gen=32, real_rendered_prompt, 64k ctx, q4 KV, target_feat_ctx=1024","note":"committed parser still reports 0 due escaped whitespace regex; output shows committed=33, fix parser next"}}
{"run":5,"commit":"6510b31","metric":6.32999,"metrics":{"tps":6.32999,"e2e_tps":1.207183,"spec_sec":26.508,"gen_tokens":32,"steps":18,"committed":33,"step_ms":280.85,"pack_ms":8.91,"draft_ms":204.58,"topk_ms":21.5,"exact_ms":45.83,"exact_decode_ms":0,"acceptance":1.833},"status":"discard","description":"fix committed metric parser; benchmark noise slightly lower than baseline","timestamp":1777494820583,"segment":1,"confidence":null,"asi":{"hypothesis":"correct benchmark committed-token parsing without changing runtime code","rollback_reason":"primary decode TPS was slightly worse than baseline, likely noise; no runtime optimization tested","next_action_hint":"parser fix is in autoresearch.sh and should be preserved as an autoresearch file; proceed to source-level optimization"}}
{"run":6,"commit":"73f2fb0","metric":7.73072,"metrics":{"tps":7.73072,"e2e_tps":1.251564,"spec_sec":25.568,"gen_tokens":32,"steps":17,"committed":33,"step_ms":243.49,"pack_ms":4.49,"draft_ms":171.03,"topk_ms":19.51,"exact_ms":48.43,"exact_decode_ms":0,"acceptance":1.941},"status":"keep","description":"benchmark target feature window 512 for lower draft/pack cost","timestamp":1777494901661,"segment":1,"confidence":14.673204954627211,"asi":{"hypothesis":"smaller DFlash target feature context may reduce pack/upload and draft compute enough to improve decode TPS on the real rendered prompt","result":"LLAMA_DDTREE_TARGET_FEAT_CTX=512 improved decode TPS from 6.42 to 7.73; pack 8.88->4.49 ms, draft 201.75->171.03 ms, acceptance 1.83->1.94","next_action_hint":"confirm 512 on repeated run and test 256/768; if stable, consider default/window recommendation for server workload"}}
{"run":7,"commit":"2a8eba2","metric":8.388756,"metrics":{"tps":8.388756,"e2e_tps":1.262128,"spec_sec":25.354,"gen_tokens":32,"steps":17,"committed":33,"step_ms":224.39,"pack_ms":2.24,"draft_ms":154.39,"topk_ms":19.77,"exact_ms":47.96,"exact_decode_ms":0,"acceptance":1.941},"status":"keep","description":"benchmark target feature window 256 for further draft/pack reduction","timestamp":1777494974670,"segment":1,"confidence":2.8119551947912877,"asi":{"hypothesis":"target feature context can be reduced below 512 on this prompt without hurting proposal quality, further lowering draft compute and pack cost","result":"256 improved decode TPS to 8.39; draft dropped to 154 ms and pack to 2.24 ms with same acceptance as 512","next_action_hint":"test 128 and 384; watch acceptance/regressions because too short a feature window may harm draft quality on broader prompts"}}
{"run":8,"commit":"3f125a4","metric":8.751467,"metrics":{"tps":8.751467,"e2e_tps":1.277649,"spec_sec":25.046,"gen_tokens":32,"steps":17,"committed":33,"step_ms":215.09,"pack_ms":1.09,"draft_ms":144.76,"topk_ms":20.79,"exact_ms":48.41,"exact_decode_ms":0,"acceptance":1.941},"status":"keep","description":"benchmark target feature window 128","timestamp":1777495047214,"segment":1,"confidence":2.2847052207843856,"asi":{"hypothesis":"a 128-token target feature window may retain enough recent signal while reducing draft attention and upload cost","result":"128 improved decode TPS to 8.75; draft 144.76 ms, pack 1.09 ms, acceptance unchanged vs 256/512","next_action_hint":"test 64 and longer generation/prompt coverage before changing default; risk is hidden acceptance drop on other prompts"}}
{"run":9,"commit":"3f125a4","metric":8.481742,"metrics":{"tps":8.481742,"e2e_tps":1.274139,"spec_sec":25.115,"gen_tokens":32,"steps":17,"committed":33,"step_ms":221.93,"pack_ms":0.47,"draft_ms":153.01,"topk_ms":20.45,"exact_ms":47.96,"exact_decode_ms":0,"acceptance":1.941},"status":"discard","description":"benchmark target feature window 64; pack lower but draft slower than 128","timestamp":1777495120133,"segment":1,"confidence":4.187908592095226,"asi":{"hypothesis":"shrinking target feature window below 128 may further reduce pack and draft context work","rollback_reason":"64 lowered pack to 0.47 ms but draft compute rose to 153 ms and decode TPS fell below the 128-window best","next_action_hint":"treat 128 as the current sweet spot on this prompt; test 96/160 only if tuning window further matters"}}
{"run":10,"commit":"3f125a4","metric":7.958279,"metrics":{"tps":7.958279,"e2e_tps":1.256676,"spec_sec":25.464,"gen_tokens":32,"steps":19,"committed":33,"step_ms":211.63,"pack_ms":0.79,"draft_ms":147.96,"topk_ms":19.88,"exact_ms":42.96,"exact_decode_ms":0,"acceptance":1.737},"status":"discard","description":"benchmark target feature window 96; lower per-step cost lost acceptance","timestamp":1777495203736,"segment":1,"confidence":4.455149647635071,"asi":{"hypothesis":"96-token target feature context might sit between 64 and 128 with lower draft cost but enough proposal quality","rollback_reason":"acceptance dropped from 1.94 to 1.74 and required 19 steps; decode TPS below 128-window best","next_action_hint":"128 remains better than smaller windows for this prompt; test 160/192 or move to non-window optimizations"}}
{"run":11,"commit":"3f125a4","metric":8.742524,"metrics":{"tps":8.742524,"e2e_tps":1.276935,"spec_sec":25.06,"gen_tokens":32,"steps":17,"committed":33,"step_ms":215.31,"pack_ms":1.34,"draft_ms":147.17,"topk_ms":18.84,"exact_ms":47.92,"exact_decode_ms":0,"acceptance":1.941},"status":"discard","description":"benchmark target feature window 160; tied 128 within noise but no improvement","timestamp":1777495276127,"segment":1,"confidence":4.609797945056553,"asi":{"hypothesis":"160-token window may reduce noise versus 128 while keeping acceptance and similar draft cost","rollback_reason":"decode TPS was effectively tied but below the 128-window best; no primary improvement","next_action_hint":"128/160 are close; choose 128 for lower memory/pack unless longer prompt validation favors 160"}}
{"run":12,"commit":"3f125a4","metric":8.341175,"metrics":{"tps":8.341175,"e2e_tps":1.263873,"spec_sec":25.319,"gen_tokens":32,"steps":17,"committed":33,"step_ms":225.67,"pack_ms":1.61,"draft_ms":155.69,"topk_ms":20.27,"exact_ms":48.07,"exact_decode_ms":0,"acceptance":1.941},"status":"discard","description":"benchmark target feature window 192; slower draft than 128/160","timestamp":1777495349316,"segment":1,"confidence":5.810668520414904,"asi":{"hypothesis":"192-token window may retain proposal quality while staying much cheaper than 256/512","rollback_reason":"acceptance matched 128 but draft/step time regressed, so primary TPS fell","next_action_hint":"do not tune larger windows for this prompt unless broader validation shows 128 harms acceptance"}}
{"run":13,"commit":"3f125a4","metric":8.477158,"metrics":{"tps":8.477158,"e2e_tps":1.282257,"spec_sec":24.956,"gen_tokens":32,"steps":17,"committed":33,"step_ms":222.05,"pack_ms":1.08,"draft_ms":153.39,"topk_ms":19.58,"exact_ms":47.97,"exact_decode_ms":0,"acceptance":1.941},"status":"discard","description":"default target feature window 128 plus smaller draft context","timestamp":1777495532959,"segment":1,"confidence":6.104510117006526,"asi":{"hypothesis":"make 128 the code default and size draft n_ctx to target feature window + block so server avoids oversized draft context","rollback_reason":"primary decode TPS was below the prior 128-window env best despite lower set_inputs; draft compute/noise dominated and source change did not improve best","next_action_hint":"revisit draft n_ctx sizing separately with repeated runs; the log showed draft n_ctx=256 and set_inputs ~0.7 ms vs ~4 ms, but step time was not better"}}
{"run":14,"commit":"3f125a4","metric":8.572515,"metrics":{"tps":8.572515,"e2e_tps":1.275053,"spec_sec":25.097,"gen_tokens":32,"steps":17,"committed":33,"step_ms":219.58,"pack_ms":1.08,"draft_ms":149.11,"topk_ms":20.98,"exact_ms":48.38,"exact_decode_ms":0,"acceptance":1.941},"status":"discard","description":"replace small-K heap top-k with fixed array scan","timestamp":1777495681069,"segment":1,"confidence":6.592190362045204,"asi":{"hypothesis":"avoid per-row heap allocation/maintenance in extract_top_k_logprobs for K=8 using fixed stack arrays","rollback_reason":"topk time increased to 20.98 ms and primary TPS remained below the 128-window best; std heap path is not the bottleneck or is better optimized","next_action_hint":"future top-k gains likely need GPU-side logits processing or avoiding logsumexp/scanning, not a small CPU data structure tweak"}}
{"run":15,"commit":"3f125a4","metric":8.708952,"metrics":{"tps":8.708952,"e2e_tps":1.275764,"spec_sec":25.083,"gen_tokens":32,"steps":17,"committed":33,"step_ms":216.14,"pack_ms":1.09,"draft_ms":151.15,"topk_ms":16.14,"exact_ms":47.73,"exact_decode_ms":0,"acceptance":1.941},"status":"discard","description":"benchmark budget 14 with 128-window; lower top-k cost but no TPS win","timestamp":1777495763704,"segment":1,"confidence":7.965359774029058,"asi":{"hypothesis":"budget 14 triggers cheaper K=1/argmax proposal extraction while preserving the same accepted chain on this prompt","rollback_reason":"topk dropped 20.8->16.1 ms but total step time did not beat the 128-window budget-22 best; likely draft/noise dominates","next_action_hint":"test budget 8/1 only if looking for lower overhead mode; budget 14 is close but not a primary improvement"}}
{"run":16,"commit":"3f125a4","metric":8.433481,"metrics":{"tps":8.433481,"e2e_tps":1.267578,"spec_sec":25.245,"gen_tokens":32,"steps":17,"committed":33,"step_ms":223.2,"pack_ms":1.08,"draft_ms":156.77,"topk_ms":17.67,"exact_ms":47.64,"exact_decode_ms":0,"acceptance":1.941},"status":"discard","description":"benchmark budget 8 with 128-window; slower than budget 14/22","timestamp":1777495844676,"segment":1,"confidence":8.4658857012172,"asi":{"hypothesis":"smaller budget may reduce proposal overhead without reducing accepted chain length in exact-validation mode","rollback_reason":"budget 8 had same step count but slower draft/topk aggregate than budget 14 and below best TPS","next_action_hint":"budget tuning is not the next major path; keep budget 22 or 14 and focus draft/exact decode"}}
{"run":17,"commit":"3f125a4","metric":8.123665,"metrics":{"tps":8.123665,"e2e_tps":1.582756,"spec_sec":26.536,"gen_tokens":42,"steps":24,"committed":42,"step_ms":215.42,"pack_ms":1.02,"draft_ms":150.09,"topk_ms":20.84,"exact_ms":43.43,"exact_decode_ms":0,"acceptance":1.75},"status":"discard","description":"confirm 128-window on longer gen request; generation ended at 42 tokens and TPS lower","timestamp":1777495921126,"segment":1,"confidence":7.969102337827434,"asi":{"hypothesis":"longer generation should reduce noise and confirm whether 128-window remains best beyond a 32-token sample","rollback_reason":"request stopped after 42 generated tokens and acceptance fell to 1.75; decode TPS below current best","next_action_hint":"use a non-EOS prompt or different fixture for long-generation confirmation; current rendered prompt is not ideal for 64-token stability"}}
{"run":18,"commit":"c2c95e3","metric":9.112863,"metrics":{"tps":9.112863,"e2e_tps":1.2838,"spec_sec":24.926,"gen_tokens":32,"steps":17,"committed":33,"step_ms":206.56,"pack_ms":1.06,"draft_ms":137.65,"topk_ms":19.8,"exact_ms":48.01,"exact_decode_ms":0,"acceptance":1.941},"status":"keep","description":"change DDTree default target feature window to 128","timestamp":1777496003711,"segment":1,"confidence":8.71562209789579,"asi":{"hypothesis":"make the observed 128-token target feature window the default so server/e2e use the faster draft context without requiring an env override","result":"default 128 produced the best run so far: 9.11 decode TPS, draft 137.65 ms, pack 1.06 ms, acceptance unchanged at 1.94","next_action_hint":"validate on additional prompts before treating 128 as globally safe; env knob still allows raising to 512/1024 if acceptance drops"}}
{"run":19,"commit":"c2c95e3","metric":8.611341,"metrics":{"tps":8.611341,"e2e_tps":1.273784,"spec_sec":25.122,"gen_tokens":32,"steps":17,"committed":33,"step_ms":218.59,"pack_ms":1.07,"draft_ms":149.86,"topk_ms":19.62,"exact_ms":48.01,"exact_decode_ms":0,"acceptance":1.941},"status":"discard","description":"repeat default 128-window run for noise check","timestamp":1777496086262,"segment":1,"confidence":9.96049456675487,"asi":{"hypothesis":"re-run the kept 128 default to estimate noise and verify improvement is not a one-off","rollback_reason":"repeat was below the 9.11 best but still far above the original 1024-window baseline; no new code changes to keep","next_action_hint":"treat 128 default as real but noisy; future comparisons should beat about 8.6-9.1 decode TPS"}}
{"run":20,"commit":"c2c95e3","metric":8.819946,"metrics":{"tps":8.819946,"e2e_tps":1.273885,"spec_sec":25.12,"gen_tokens":32,"steps":17,"committed":33,"step_ms":213.42,"pack_ms":1.09,"draft_ms":144.99,"topk_ms":19.36,"exact_ms":47.94,"exact_decode_ms":0,"acceptance":1.941},"status":"discard","description":"disable DDTree micro-profile logging during benchmark","timestamp":1777496178429,"segment":1,"confidence":10.150139806908188,"asi":{"hypothesis":"LLAMA_DDTREE_PROFILE logging may add per-step overhead, so production benchmarking should disable it","rollback_reason":"no-profile run did not beat the kept 9.11 TPS best, though it remained above baseline","next_action_hint":"keep profiling disabled for user-facing server unless collecting diagnostics; script knob is preserved in autoresearch.sh"}}
{"run":21,"commit":"c2c95e3","metric":8.471256,"metrics":{"tps":8.471256,"e2e_tps":1.271052,"spec_sec":25.176,"gen_tokens":32,"steps":18,"committed":33,"step_ms":209.86,"pack_ms":1.08,"draft_ms":151.2,"topk_ms":12.38,"exact_ms":45.18,"exact_decode_ms":0,"acceptance":1.833},"status":"discard","description":"diagnostic dynamic DDTree block size 8","timestamp":1777496331268,"segment":1,"confidence":10.70842957726881,"asi":{"hypothesis":"smaller draft block size may reduce draft/top-k compute enough to offset lower speculative horizon","rollback_reason":"block size 8 reduced topk but acceptance dropped and an extra step was needed; primary TPS below current 128-window default","next_action_hint":"keep block size 16; reducing block size does not help this prompt"}}
{"run":22,"commit":"c2c95e3","metric":8.249464,"metrics":{"tps":8.249464,"e2e_tps":1.263823,"spec_sec":25.32,"gen_tokens":32,"steps":19,"committed":33,"step_ms":204.16,"pack_ms":0.23,"draft_ms":141.61,"topk_ms":19.45,"exact_ms":42.84,"exact_decode_ms":0,"acceptance":1.737},"status":"discard","description":"benchmark target feature window 32; too little context hurts acceptance","timestamp":1777496404861,"segment":1,"confidence":11.331709410339274,"asi":{"hypothesis":"very small target feature window may lower draft compute enough to compensate for weaker proposals","rollback_reason":"acceptance dropped to 1.74 and 19 steps were needed, so TPS stayed below the 128 default","next_action_hint":"do not go below 128 for this workload unless a broader prompt shows different behavior"}}
{"run":23,"commit":"c2c95e3","metric":8.67164,"metrics":{"tps":8.67164,"e2e_tps":1.279284,"spec_sec":25.014,"gen_tokens":32,"steps":17,"committed":33,"step_ms":217.07,"pack_ms":1.07,"draft_ms":151.99,"topk_ms":16.08,"exact_ms":47.9,"exact_decode_ms":0,"acceptance":1.941},"status":"discard","description":"use K=1 proposal extraction for default exact-validation path","timestamp":1777496508196,"segment":1,"confidence":11.723927501915169,"asi":{"hypothesis":"when batched tree verify is disabled, default exact validation can use a top-1 draft chain instead of K=8 tree proposals to reduce top-k overhead while remaining correct","rollback_reason":"topk improved by ~3.7 ms but total step time stayed below the 128-window best because draft compute/noise dominated","next_action_hint":"K=1 is a possible conservative mode but not a net win in this benchmark; do not keep as default"}}
{"run":24,"commit":"c2c95e3","metric":8.675637,"metrics":{"tps":8.675637,"e2e_tps":1.271102,"spec_sec":25.175,"gen_tokens":32,"steps":17,"committed":33,"step_ms":216.97,"pack_ms":1.06,"draft_ms":148.41,"topk_ms":19.69,"exact_ms":47.77,"exact_decode_ms":0,"acceptance":1.941},"status":"discard","description":"cache DFlash mask token embedding in DDTree driver","timestamp":1777496601681,"segment":1,"confidence":11.829481672771372,"asi":{"hypothesis":"avoid per-step mask embedding lookup/allocation when building draft noise embeddings","rollback_reason":"change was correct but primary TPS did not beat the 128-window best; mask embedding work is not a measurable bottleneck","next_action_hint":"focus on draft graph compute or exact target decode rather than small CPU setup around noise embeddings"}}
{"run":25,"commit":"c2c95e3","metric":0,"metrics":{"tps":0,"e2e_tps":0,"spec_sec":21.707,"gen_tokens":0,"steps":1,"committed":0,"step_ms":0,"pack_ms":3.58,"draft_ms":152.52,"topk_ms":18.22,"exact_ms":0,"exact_decode_ms":0,"acceptance":0},"status":"crash","description":"fast-batched fast-rollback at 128-window still OOMs persist on 64k full-draft","timestamp":1777496697475,"segment":1,"confidence":11.829481672771372,"asi":{"hypothesis":"smaller target feature window might free enough memory for fast rollback persist with -ngl65 -ngld6 -c65536","rollback_reason":"persist allocation still failed needing 1707.75 MiB; with SNAPSHOT_FALLBACK=0 driver returned empty output","next_action_hint":"fast rollback remains nonviable for full-draft 64k on this 24GB GPU unless memory is freed elsewhere; test q4/tq3 or reduced draft offload only if willing to trade draft speed"}}
{"run":26,"commit":"c2c95e3","metric":0,"metrics":{"tps":0,"e2e_tps":0,"spec_sec":0,"gen_tokens":0,"steps":0,"committed":0,"step_ms":0,"pack_ms":0,"draft_ms":0,"topk_ms":0,"exact_ms":0,"exact_decode_ms":0,"acceptance":0},"status":"crash","description":"try tq3 KV to fit fast rollback persist; e2e harness does not accept tq3_0","timestamp":1777496743075,"segment":1,"confidence":11.829481672771372,"asi":{"hypothesis":"TQ3 KV might free enough VRAM for fast rollback persist with full target/draft offload","rollback_reason":"test-speculative-tree-e2e only accepts its hardcoded KV type set and rejected --kv-type tq3_0","next_action_hint":"add tq3_0 support to e2e parser before testing this; do not infer runtime viability from this crash"}}
{"run":27,"commit":"c2c95e3","metric":0,"metrics":{"tps":0,"e2e_tps":0,"spec_sec":26.717,"gen_tokens":0,"steps":1,"committed":0,"step_ms":0,"pack_ms":3.47,"draft_ms":153,"topk_ms":22.52,"exact_ms":0,"exact_decode_ms":0,"acceptance":0},"status":"crash","description":"add tq3_0 e2e parser support and retry fast rollback; persist still OOMs","timestamp":1777496853671,"segment":1,"confidence":11.829481672771372,"asi":{"hypothesis":"with e2e tq3_0 support, smaller KV cache may fit the 1.7 GiB fast rollback persist buffer","rollback_reason":"tq3_0 run still failed CUDA persist allocation for 1707.75 MiB and returned empty output with snapshot fallback disabled","next_action_hint":"fast rollback requires a larger memory reduction than q4->tq3 KV provides in this harness; avoid more persist-fit tests unless freeing draft layers or compressing persist"}}
