{"run":100,"commit":"c499e6d","metric":0,"metrics":{"tps":0,"e2e_tps":0,"spec_sec":22.457,"gen_tokens":0,"steps":1,"committed":0,"step_ms":0,"pack_ms":3.57,"draft_ms":157.23,"topk_ms":20.94,"exact_ms":0,"exact_decode_ms":0,"acceptance":0},"status":"crash","description":"64k fast rollback fit probe with smaller batch buffers and budget 22","timestamp":1777506423953,"segment":1,"confidence":10.999616549456363,"asi":{"hypothesis":"with n_batch/n_ubatch reduced to 256, 64k may have enough memory for budget22 fast rollback persist, restoring more acceptance than budget8/14 while avoiding exact validation","rollback_reason":"budget22 persist still OOMed before generating tokens, so no throughput result; snapshot fallback was disabled intentionally to test true fast rollback fit","result":"CUDA allocation failed for 1707.75 MiB persist at n_tokens=22 even with n_batch=256,n_ubatch=256; budget14 is the largest tested 64k rollback configuration that fits, but it is too slow","next_action_hint":"do not pursue higher budget fast rollback under current 64k/full-draft memory envelope. Fast rollback needs either a smaller persist representation or major memory freeing; shift to target_tree cost reduction or GPU-resident target_feat ring diagnostics."}}
{"run":101,"commit":"c499e6d","metric":0,"metrics":{"tps":0,"e2e_tps":0,"spec_sec":26.823,"gen_tokens":0,"steps":1,"committed":0,"step_ms":0,"pack_ms":1.57,"draft_ms":153.13,"topk_ms":21.01,"exact_ms":0,"exact_decode_ms":0,"acceptance":0},"status":"crash","description":"64k fast rollback fit probe with n_batch 128 and budget 22","timestamp":1777506525928,"segment":1,"confidence":10.999616549456363,"asi":{"hypothesis":"reducing n_batch/n_ubatch further from 256 to 128 may free enough 64k GPU memory for budget22 fast rollback persist, restoring acceptance while avoiding exact validation","rollback_reason":"budget22 persist still OOMed before generating tokens even with n_batch=128; snapshot fallback was disabled intentionally to test true fast rollback fit","result":"CUDA allocation failed for 1707.75 MiB persist at n_tokens=22; reducing n_batch below 256 did not free enough additional memory, while prompt_ingests doubled to 160","next_action_hint":"stop trying to fit budget22/32 fast rollback via n_batch reduction. Need different persist representation, moving buffers off GPU, or target_tree/GPU target_feat root-cause work."}}
{"run":102,"commit":"c499e6d","metric":3.404755,"metrics":{"tps":3.404755,"e2e_tps":1.040312,"spec_sec":30.76,"gen_tokens":32,"steps":14,"committed":33,"step_ms":671.33,"pack_ms":1.15,"draft_ms":144.48,"topk_ms":20.62,"exact_ms":59.5,"exact_decode_ms":0,"acceptance":2.357},"status":"discard","description":"aggregate batched-vs-exact margin diagnostics at proposal temp 0.7","timestamp":1777506711000,"segment":1,"confidence":10.845539326886065,"asi":{"hypothesis":"add compact aggregate margin metrics for all diagnostic batched tree steps to evaluate whether a high-confidence exact-skip rule could be safe without relying on truncated per-node trace logs","rollback_reason":"diagnostic target-tree verification and logging are expectedly much slower than the runtime exact-validation path, so primary TPS is below best and the code is not a production optimization","result":"on the current prompt with budget32/temp0.7, batched_exact_same=14 and diff=0; aggregate margin steps=14, batched_min_avg=9.087, batched_min_min=0.895, ge1 same=13/13, ge2 same=12/12, ge5 same=9/9","next_action_hint":"current prompt supports a confidence-gated exact skip with thresholds >=1 or >=2, but this is not enough to ship; validate aggregate margins on additional prompts before trusting batched posterior, and pair any exact skip with cheap state commit because snapshot+replay is slower."}}
{"run":103,"commit":"c499e6d","metric":6.832497,"metrics":{"tps":6.832497,"e2e_tps":1.205636,"spec_sec":26.542,"gen_tokens":32,"steps":17,"committed":33,"step_ms":275.5,"pack_ms":1.1,"draft_ms":157.54,"topk_ms":20.23,"exact_ms":0,"exact_decode_ms":0,"acceptance":1.941},"status":"discard","description":"64k fast rollback fit probe with smaller batch buffers and budget 16","timestamp":1777506853395,"segment":1,"confidence":10.715120218615038,"asi":{"hypothesis":"budget16 may be a 64k fast-rollback middle point that still fits with n_batch/n_ubatch=256 while improving acceptance over budget8/14 enough to offset target_tree cost","rollback_reason":"budget16 fast rollback fit and stayed bit-equal, but acceptance remained 1.94 like budget14 while step time worsened to 275.5 ms, so primary TPS stayed far below the budget32 exact-validation best","result":"64k n_batch=256,n_ubatch=256 allocated 1242.00 MiB persist, fast_rollback=17, snapshot_replays=0, exact=0, target_tree=93.03 ms, rollback=0.68 ms, correctness PASS","next_action_hint":"fast rollback parameter sweep is exhausted: budget8/14/16 fit but are slow, budget22 OOMs. Move to target_tree cost reduction, broader batched/exact confidence validation, or GPU-resident target_feat ring instead of more budget tuning."}}
{"run":104,"commit":"c499e6d","metric":3.414521,"metrics":{"tps":3.414521,"e2e_tps":1.03795,"spec_sec":30.83,"gen_tokens":32,"steps":14,"committed":33,"step_ms":669.41,"pack_ms":1.16,"draft_ms":146.87,"topk_ms":20.93,"exact_ms":60.27,"exact_decode_ms":0,"acceptance":2.357},"status":"discard","description":"target-only chain decode timing diagnostic attempt","timestamp":1777507043307,"segment":1,"confidence":10.587800455864077,"asi":{"hypothesis":"instrument the chain reference path to quantify target-only one-token decode time and compare it with DDTree exact validation, clarifying whether the target-only reference mismatch comes from target decode overhead","rollback_reason":"diagnostic output was not surfaced because autoresearch.sh only tails the last 120 lines, and a preserved TRACE env pass-through accidentally enabled expensive target-tree tracing for every run; primary TPS is therefore not comparable","result":"the run still passed correctness but showed trace overhead: target_tree=118.29 ms and snapshot=150.34 ms in the exact path; chain timing detail needs a rerun after fixing TRACE pass-through/output capture","next_action_hint":"fix autoresearch.sh so empty LLAMA_DDTREE_TRACE does not enable tracing, then rerun the chain timing diagnostic with enough output to capture chain timing detail"}}
{"run":105,"commit":"9fbce93","metric":11.924636,"metrics":{"tps":11.924636,"e2e_tps":1.328573,"spec_sec":24.086,"gen_tokens":32,"steps":14,"committed":33,"step_ms":191.68,"pack_ms":1.1,"draft_ms":114.78,"topk_ms":17.91,"exact_ms":57.86,"exact_decode_ms":0,"acceptance":2.357},"status":"keep","description":"fix empty trace pass-through and add chain timing diagnostic hook","timestamp":1777507150730,"segment":1,"confidence":13.950437243906348,"asi":{"hypothesis":"the preserved autoresearch trace env pass-through was accidentally enabling target-tree diagnostics even when LLAMA_DDTREE_TRACE was empty; fixing it should restore normal exact-validation timing and allow a target-only chain timing diagnostic hook","result":"normal exact-validation path restored: target_tree=0, snapshot=0, step=191.68 ms, draft=114.78 ms, exact=57.86 ms, acceptance=2.36, tps=11.92; this is a measurement/harness fix rather than a product-code speedup","next_action_hint":"rerun once to confirm the 11.9 TPS result is not noise, and increase autoresearch output capture further if chain timing detail is still needed"}}
{"run":106,"commit":"9fbce93","metric":10.063906,"metrics":{"tps":10.063906,"e2e_tps":1.307083,"spec_sec":24.482,"gen_tokens":32,"steps":14,"committed":33,"step_ms":227.12,"pack_ms":1.11,"draft_ms":146.94,"topk_ms":20.58,"exact_ms":58.45,"exact_decode_ms":0,"acceptance":2.357},"status":"discard","description":"repeat normal exact-validation path after trace pass-through fix","timestamp":1777507233994,"segment":1,"confidence":13.654565431988555,"asi":{"hypothesis":"repeat the restored no-trace exact-validation path to determine whether the 11.92 TPS run was a real speedup or timing noise","rollback_reason":"repeat preserved the 14-step/2.36 acceptance behavior and no target_tree overhead, but step time returned to 227 ms and primary TPS fell below the kept 11.92 run","result":"target_tree=0 and snapshot=0 confirm the trace pass-through fix works; the 11.92 TPS run was mostly draft/step-time noise, while normal performance remains around 10.0 TPS","next_action_hint":"continue comparing future changes against a noisy 10.0-11.9 TPS range; if chain timing detail is still needed, make autoresearch.sh print the chain timing lines explicitly instead of relying on tail length."}}
{"run":107,"commit":"9fbce93","metric":9.951734,"metrics":{"tps":9.951734,"e2e_tps":1.299756,"spec_sec":24.62,"gen_tokens":32,"steps":14,"committed":33,"step_ms":229.68,"pack_ms":1.12,"draft_ms":149.57,"topk_ms":20.36,"exact_ms":58.6,"exact_decode_ms":0,"acceptance":2.357},"status":"discard","description":"surface target-only chain decode timing diagnostic","timestamp":1777507363548,"segment":1,"confidence":13.340332316400888,"asi":{"hypothesis":"print the chain reference timing lines from the full benchmark log so we can compare target-only one-token decode against DDTree exact validation and identify whether target decode itself is anomalously slow","rollback_reason":"this was a diagnostic harness output change and primary TPS stayed below the kept best; no production code speedup","result":"target-only chain after prompt has decode_avg=24.79 ms over 32 tokens, while DDTree exact validation is 58.60 ms per speculative step plus draft/topk; the target-only server reference gap is therefore not explained by base one-token target decode alone","next_action_hint":"investigate why DDTree exact validation costs ~58 ms/step versus target-only 1-token decode ~25 ms, likely hidden capture, seq_rm/cache state, or validation loop overhead; profile exact validation internals before more proposal tuning"}}
{"run":108,"commit":"9fbce93","metric":10.245246,"metrics":{"tps":10.245246,"e2e_tps":1.309436,"spec_sec":24.438,"gen_tokens":32,"steps":14,"committed":33,"step_ms":223.1,"pack_ms":1.11,"draft_ms":143.19,"topk_ms":20.11,"exact_ms":58.66,"exact_decode_ms":58.19,"acceptance":2.357},"status":"discard","description":"profile exact validation decode/sample timing","timestamp":1777507489027,"segment":1,"confidence":12.942229525616327,"asi":{"hypothesis":"instrument exact validation internals to determine whether the ~58 ms exact cost comes from llama_decode, logits sampling, advance callbacks, or driver overhead","rollback_reason":"diagnostic timing output only; primary TPS stayed below the kept best and there is no product-code optimization in this change","result":"exact validation is almost entirely target llama_decode: exact=58.66 ms/step, exact_decode=58.19 ms/step, exact_sample=0.41 ms/step, exact_nodes=33 over 14 steps; target-only chain decode remains 24.69 ms/token","next_action_hint":"focus on why exact validation llama_decode is ~2.35x slower per token than target-only chain decode: hidden capture enabled during spec, seq_rm/KV state mutations, or context state after draft/tree operations. Run a controlled chain-with-hidden-capture timing diagnostic next."}}
{"run":109,"commit":"9fbce93","metric":10.373578,"metrics":{"tps":10.373578,"e2e_tps":1.315735,"spec_sec":24.321,"gen_tokens":32,"steps":14,"committed":33,"step_ms":220.34,"pack_ms":1.12,"draft_ms":139.62,"topk_ms":20.94,"exact_ms":58.62,"exact_decode_ms":0,"acceptance":2.357},"status":"discard","description":"chain decode timing with hidden capture enabled","timestamp":1777507637568,"segment":1,"confidence":12.882552326173203,"asi":{"hypothesis":"if hidden capture is the reason DDTree exact validation llama_decode is ~2.35x slower than target-only chain decode, enabling capture_hidden on the chain reference should raise chain decode_avg toward ~58 ms/token","rollback_reason":"diagnostic-only harness/env pass-through change; primary TPS did not improve over the kept best","result":"with LLAMA_DDTREE_CHAIN_CAPTURE=1, chain decode_avg remained 24.74 ms/token while DDTree exact stayed 58.62 ms/step; hidden capture alone does not explain the exact-validation decode slowdown","next_action_hint":"next isolate seq_rm/KV state mutation or repeated position rollback effects: run target-only chain with seq_rm before each decode, or instrument exact validation to measure llama_memory_seq_rm and per-node decode depth costs."}}
{"run":110,"commit":"9fbce93","metric":10.039594,"metrics":{"tps":10.039594,"e2e_tps":1.291312,"spec_sec":24.781,"gen_tokens":32,"steps":14,"committed":33,"step_ms":227.67,"pack_ms":1.11,"draft_ms":147.57,"topk_ms":20.34,"exact_ms":58.61,"exact_decode_ms":0,"acceptance":2.357},"status":"discard","description":"chain decode timing with hidden capture and seq_rm controls","timestamp":1777507811343,"segment":1,"confidence":12.847363213337257,"asi":{"hypothesis":"if DDTree exact validation is slower because of hidden capture or the seq_rm call before validation, then target-only chain decode with capture_hidden plus seq_rm before every decode should approach the ~58 ms exact-validation cost","rollback_reason":"diagnostic-only harness changes; primary TPS stayed below the kept best and no production optimization was introduced","result":"chain with capture+seq_rm still decoded at 24.81 ms/token; seq_rm itself averaged only 0.026 ms. DDTree exact remained 58.61 ms/step, so neither hidden capture nor a no-op seq_rm explains the slowdown","next_action_hint":"isolate context-state effects specific to DDTree exact validation: repeated decode of root/current positions after previous speculative commits, recurrent/SSM state mutation, or graph shape/reuse differences. Next useful diagnostic is per-depth exact decode timing or chain replay pattern that decodes root+accepted path chunks like validation."}}
{"run":111,"commit":"9fbce93","metric":10.079439,"metrics":{"tps":10.079439,"e2e_tps":1.297911,"spec_sec":24.655,"gen_tokens":32,"steps":14,"committed":33,"step_ms":226.77,"pack_ms":1.11,"draft_ms":146.48,"topk_ms":20.54,"exact_ms":58.6,"exact_decode_ms":58.14,"acceptance":2.357},"status":"discard","description":"normalize exact validation decode cost per node","timestamp":1777507941061,"segment":1,"confidence":12.752562835954159,"asi":{"hypothesis":"the apparent ~58 ms exact-validation cost may be per speculative step, not per target token; logging exact_nodes and exact_decode per node should clarify whether exact llama_decode is actually slower than target-only chain decode","rollback_reason":"diagnostic-only harness logging; primary TPS stayed below the kept best and no runtime optimization was introduced","result":"exact_nodes=33 over 14 steps; exact_decode=58.14 ms/step but exact_node=24.66 ms/token, matching target-only chain decode_avg=24.76 ms/token. Exact validation is not slower per token; it costs about accepted_nodes_per_step target decodes.","next_action_hint":"stop treating exact validation as a per-token slowdown. The remaining throughput gap is structural: each DDTree step pays draft/topk plus ~2.36 target decodes. Next focus on either trusting batched posterior with cheap state commit, reducing target decodes per step, or lowering draft/topk cost."}}
{"run":112,"commit":"9fbce93","metric":10.473398,"metrics":{"tps":10.473398,"e2e_tps":1.308312,"spec_sec":24.459,"gen_tokens":32,"steps":14,"committed":33,"step_ms":218.24,"pack_ms":0.95,"draft_ms":139.62,"topk_ms":19.74,"exact_ms":57.9,"exact_decode_ms":0,"acceptance":2.357},"status":"discard","description":"test smaller target feature window 112 with proposal temp 0.7","timestamp":1777508043255,"segment":1,"confidence":12.651180373150947,"asi":{"hypothesis":"with proposal_temp=0.7 preserving the 14-step acceptance pattern, reducing target_feat_ctx from 128 to 112 may lower draft/pack cost without losing proposal quality","rollback_reason":"target_feat_ctx=112 preserved 14 steps and 2.36 acceptance and reduced pack/draft versus typical 128 runs, but primary TPS did not beat the kept best and remains within the noisy 10.0-11.9 range","result":"112-window produced tps=10.47, step=218.24 ms, draft=139.62 ms, pack=0.95 ms, acceptance=2.36; proposal_temp=0.7 appears to recover the acceptance loss previously seen at 112 without a clear primary improvement","next_action_hint":"test 96 or 104 only if looking for more draft-cost reduction, but compare against noise; avoid declaring smaller windows best until repeated and validated on broader prompts"}}
{"run":113,"commit":"9fbce93","metric":9.938876,"metrics":{"tps":9.938876,"e2e_tps":1.298174,"spec_sec":24.65,"gen_tokens":32,"steps":16,"committed":33,"step_ms":201.23,"pack_ms":0.88,"draft_ms":131.18,"topk_ms":18.74,"exact_ms":50.38,"exact_decode_ms":0,"acceptance":2.062},"status":"discard","description":"test smaller target feature window 104 with proposal temp 0.7","timestamp":1777508138445,"segment":1,"confidence":13.074597480445423,"asi":{"hypothesis":"with proposal_temp=0.7, target_feat_ctx=104 may further reduce draft/pack cost while still preserving enough proposal quality to beat the 128-window exact-validation path","rollback_reason":"104 reduced draft/pack and per-step time, but lost the 14-step acceptance pattern: steps rose to 16 and acceptance fell to 2.06, so primary TPS stayed below the current best","result":"target_feat_ctx=104 produced step=201.23 ms, draft=131.18 ms, pack=0.88 ms, but required 16 steps; smaller windows below 112 start trading away the structural acceptance gain","next_action_hint":"avoid shrinking target_feat_ctx below 112 for this prompt/temp unless validating a latency-focused variant; next try broader-prompt batched/exact confidence validation or target_tree/state-commit work rather than more small window tuning"}}
{"type":"config","name":"Optimize DFlash DDTree decode TPS on Castle - Phase 2: Batched posterior + fast commit","metricName":"tps","metricUnit":"","bestDirection":"higher"}
{"run":114,"commit":"166b674","metric":9.411626,"metrics":{},"status":"keep","description":"Phase 2 baseline: proposal_temp=0.7, budget=32, target_feat_ctx=128, exact-validation path on real_rendered_prompt","timestamp":1777537489249,"segment":2,"confidence":null,"asi":{"hypothesis":"establish new segment baseline with current best config before pursuing batched posterior validation and fast commit optimizations","benchmark":"./autoresearch.sh on Castle; gen=32; prompt=/tmp/real_rendered_prompt.txt; LLAMA_DDTREE_PROPOSAL_TEMP=0.7; LLAMA_DDTREE_TARGET_FEAT_CTX=128","note":"steps=15 vs previous segment best 14-step runs; within noise band 9.4-10.5 TPS"}}
{"run":115,"commit":"9fbce93","metric":7.28014,"metrics":{},"status":"discard","description":"fast-batched + fast-rollback with budget 10 at 64k context","timestamp":1777541038238,"segment":2,"confidence":null,"asi":{"hypothesis":"test whether fast-batched path with small budget 10 can achieve acceptable TPS without exact validation","note":"fast rollback fits at budget10 with n_batch=256; acceptance=1.94, step=258ms, TPS=7.28 vs baseline 9.41","next_action_hint":"budget10 fast-batched is worse than exact path; try smaller budgets or combine with other optimizations"}}
{"run":116,"commit":"9fbce93","metric":7.136072,"metrics":{},"status":"discard","description":"fast-batched + fast-rollback with budget 14 at 64k context","timestamp":1777541046222,"segment":2,"confidence":null,"asi":{"hypothesis":"test whether budget 14 fast-batched improves over budget 10 with better acceptance","note":"budget 14 step time increased to 264ms but acceptance stayed 1.94; TPS=7.14 worse than budget 10","next_action_hint":"larger budgets increase target_tree cost without acceptance gain in fast-batched mode; smaller budgets may be better"}}
{"run":117,"commit":"9fbce93","metric":7.851335,"metrics":{},"status":"discard","description":"fast-batched + fast-rollback with budget 8 at 64k context","timestamp":1777541054565,"segment":2,"confidence":null,"asi":{"hypothesis":"test whether budget 8 fast-batched achieves best TPS among small-budget fast-rollback fits","next_action_hint":"budget 8 is the best fast-batched config so far (7.85 TPS) but still below exact path; target_tree decode dominates fast-batched cost","note":"budget 8 step=226ms, acceptance=1.83, draft=135ms; fast-batched path consistently slower than exact validation for this implementation"}}
{"run":118,"commit":"ade211a","metric":10.195434,"metrics":{"e2e_tps":1.306336,"spec_sec":24.496,"gen_tokens":32,"steps":14,"committed":33,"step_ms":224.19,"pack_ms":1.16,"draft_ms":143.91,"topk_ms":20.75,"exact_ms":58.32,"acceptance":2.357},"status":"keep","description":"test DDTree top_k=4 with proposal temp 0.7 exact-validation path","timestamp":1777543025604,"segment":2,"confidence":1.0958318828179303,"asi":{"benchmark":"./autoresearch.sh; prompt=/tmp/real_rendered_prompt.txt; LLAMA_DDTREE_PROPOSAL_TEMP=0.7; AUTORESEARCH_BUDGET=32; LLAMA_DDTREE_TOP_K=4","hypothesis":"reducing DDTree top-k cardinality from default 8 to 4 may lower CPU top-k scan cost without losing acceptance on this prompt","next_action_hint":"repeat K=4 and test K=2 to see if smaller K continues to help or hurts acceptance; if stable, consider defaulting to K=4","note":"first K=4 run gave 10.20 TPS, repeat gave 10.03; both above 9.41 baseline but within historical 9.4-10.5 noise band; draft/step time slightly lower than baseline"}}
