{"run":119,"commit":"e385d50","metric":10.147005,"metrics":{"acceptance":2.357,"committed":33,"draft_ms":145.55,"e2e_tps":1.302932,"exact_ms":58.27,"gen_tokens":32,"pack_ms":0.94,"spec_sec":24.56,"step_ms":225.26,"steps":14,"topk_ms":20.47},"status":"keep","description":"test target_feat_ctx=112 with top_k=4 and proposal_temp=0.7 exact path","timestamp":1777545728081,"segment":2,"confidence":0.550668850678441,"asi":{"hypothesis":"smaller target feature window 112 may reduce draft compute without losing acceptance versus 128","next_action_hint":"test ctx=96 or 104 to find the lower bound; if none beat 128, keep 128 as default","note":"ctx=112 produced 10.15 TPS, step=225ms, draft=145ms, acceptance=2.36; within noise of ctx=128 best"}}
{"run":120,"commit":"ff511ad","metric":9.892726,"metrics":{"acceptance":2.429,"committed":34,"draft_ms":147.88,"e2e_tps":0.951446,"exact_ms":61.21,"gen_tokens":32,"pack_ms":1.11,"spec_sec":33.633,"step_ms":231.05,"steps":14,"topk_ms":20.82},"status":"keep","description":"exact path with n_batch=64 to validate per-layer persist allocation does not regress baseline","timestamp":1777546971003,"segment":2,"confidence":1,"asi":{"hypothesis":"validate that per-layer persist allocation + n_batch=64 does not break exact path correctness or TPS","next_action_hint":"per-layer allocation is committed and safe; continue exploring fast-batched optimization or server integration","note":"n_batch=64 exact path achieved 9.89 TPS, slightly below n_batch=512 best (10.15) but within noise; per-layer allocation code is working"}}
{"run":121,"commit":"ff511ad","metric":10.188617,"metrics":{"acceptance":2.357,"committed":33,"draft_ms":143.93,"e2e_tps":1.307029,"exact_ms":58.34,"gen_tokens":32,"pack_ms":1.11,"spec_sec":24.483,"step_ms":224.34,"steps":14,"topk_ms":20.92},"status":"discard","description":"exact path budget 40 with top_k=4 and proposal_temp=0.7 to test acceptance saturation beyond budget 32","timestamp":1777547541311,"segment":2,"confidence":1.451900946467489,"asi":{"hypothesis":"budget 40 provides more tree nodes than budget 32, potentially increasing acceptance per step enough to reduce total steps and improve overall TPS","rollback_reason":"budget 40 produced identical acceptance (2.357), steps (14), and committed (33) as budget 32, with nearly identical step time (~224ms); extra budget nodes do not improve proposal quality on this prompt","next_action_hint":"acceptance is saturated at ~2.36 for this prompt with budget >=32; try budget 28 or 30 to see if lower budget achieves same acceptance with less overhead, or switch to cross-prompt validation or server integration testing"}}
{"run":122,"commit":"974eb18","metric":11.808554,"metrics":{"acceptance":2.267,"committed":34,"draft_ms":106.3,"e2e_tps":1.32714,"exact_ms":55.5,"gen_tokens":32,"pack_ms":1.06,"spec_sec":24.112,"step_ms":180.66,"steps":15,"topk_ms":17.77},"status":"keep","description":"exact path budget 28 with top_k=4 and proposal_temp=0.7 — large draft speedup vs budget 32","timestamp":1777547640327,"segment":2,"confidence":4.982182498441078,"asi":{"hypothesis":"budget 28 may reduce draft tree-compute overhead more than it hurts acceptance, yielding better TPS than budget 32 despite slightly lower per-step acceptance","next_action_hint":"repeat budget 28 immediately to validate whether the 106ms draft time and 11.81 TPS are stable or noise; if repeatable, this is a major finding","note":"budget 28 step time dropped to 180.66ms (from ~224ms at budget 32), driven by draft_ms falling to 106.3ms (from ~144ms); acceptance slightly lower at 2.267 vs 2.357 but more than offset by per-step speedup"}}
{"run":123,"commit":"974eb18","metric":10.144721,"metrics":{"acceptance":2.267,"committed":34,"draft_ms":133.06,"e2e_tps":1.307831,"exact_ms":56.01,"gen_tokens":32,"pack_ms":1.07,"spec_sec":24.468,"step_ms":210.29,"steps":15,"topk_ms":20.12},"status":"discard","description":"repeat budget 28 to validate the 11.81 TPS result","timestamp":1777547746753,"segment":2,"confidence":6.1161100677716975,"asi":{"hypothesis":"repeat budget 28 to check whether the 11.81 TPS run was stable or noise","next_action_hint":"budget 28 repeat at 10.14 TPS is comparable to budget 32 (10.20 TPS); try budget 30 as the intermediate sweet spot, or investigate why draft time varies so widely (106-144ms)","note":"repeat budget 28 draft_ms=133.06ms, step_ms=210.29ms, TPS=10.14 — much closer to budget 32 than the first run's 106ms/180ms/11.81; first run was likely an outlier","rollback_reason":"10.14 TPS is slightly below the kept budget 32 best of 10.20 TPS; budget 28 is not clearly better"}}
{"run":124,"commit":"ff511ad","metric":10.068782,"metrics":{"acceptance":2.286,"committed":32,"draft_ms":148.42,"e2e_tps":1.304472,"exact_ms":56.42,"gen_tokens":32,"pack_ms":1.09,"spec_sec":24.531,"step_ms":227.01,"steps":14,"topk_ms":21.04},"status":"discard","description":"exact path budget 30 with top_k=4 and proposal_temp=0.7 — intermediate sweep between 28 and 32","timestamp":1777547834290,"segment":2,"confidence":13.614577179988123,"asi":{"hypothesis":"budget 30 may be the sweet spot between budget 28 and 32, preserving acceptance while reducing overhead","rollback_reason":"budget 30 produced lower acceptance (2.286 vs 2.357), higher draft time (148ms vs 144ms), and lower TPS (10.07 vs 10.20) than budget 32; budget 32 remains the best exact-path configuration","next_action_hint":"budget 32 is the exact-path sweet spot; validate on a different prompt to check for overfitting, or try top_k=6, or explore reducing exact validation cost per step"}}
{"run":125,"commit":"ff511ad","metric":14.684288,"metrics":{"acceptance":2.4,"committed":12,"draft_ms":84.62,"e2e_tps":11.472275,"exact_ms":57.61,"gen_tokens":12,"pack_ms":0.37,"spec_sec":1.046,"step_ms":163.44,"steps":5,"topk_ms":20.8},"status":"discard","description":"cross-prompt validation on qwen_rendered_prompt.txt with best config — only 12 tokens generated, not comparable to 32-token benchmark","timestamp":1777547880051,"segment":2,"confidence":5.272893061768601,"asi":{"hypothesis":"validate best config (budget 32, top_k=4, proposal_temp=0.7) on a different prompt to check for overfitting","next_action_hint":"this prompt only generated 12 tokens (EOS early), making it incomparable to the 32-token benchmark; try a different prompt that generates closer to 32 tokens, such as task761 or task0","note":"config works correctly on different prompt (bit-equal PASS) with acceptance=2.40, but short generation makes TPS incomparable"}}
{"run":126,"commit":"ff511ad","metric":7.524101,"metrics":{"acceptance":1.65,"committed":33,"draft_ms":149.57,"e2e_tps":1.181422,"exact_ms":41.2,"gen_tokens":32,"pack_ms":1.03,"spec_sec":27.086,"step_ms":212.65,"steps":20,"topk_ms":20.82},"status":"discard","description":"cross-prompt validation on task761 (21k tokens) with best config — acceptance drops to 1.65, TPS falls to 7.52","timestamp":1777547973644,"segment":2,"confidence":3.647426181911143,"asi":{"hypothesis":"validate best config on a different prompt to check for overfitting","next_action_hint":"acceptance varies significantly by prompt (1.65 vs 2.36); test whether higher budget or top_k=6 improves harder prompts without hurting the benchmark prompt","note":"task761 generated 32 tokens in 20 steps (vs 14 on real_rendered), acceptance 1.65; draft model effectiveness varies by prompt; config is correct (bit-equal PASS) but slower on this prompt","rollback_reason":"7.52 TPS is below baseline on this prompt, but this is a cross-validation run rather than a benchmark regression; the benchmark prompt remains the optimization target"}}
{"run":127,"commit":"ff511ad","metric":9.903871,"metrics":{"acceptance":2.357,"committed":33,"draft_ms":149.32,"e2e_tps":1.293766,"exact_ms":58.77,"gen_tokens":32,"pack_ms":1.11,"spec_sec":24.734,"step_ms":230.79,"steps":14,"topk_ms":21.56},"status":"discard","description":"exact path top_k=2 with budget 32 and proposal_temp=0.7 — acceptance same as top_k=4 but slightly slower","timestamp":1777548247599,"segment":2,"confidence":6.1161100677716975,"asi":{"hypothesis":"top_k=2 may reduce topk overhead while maintaining acceptance if the extra K=4 candidates are unused on this prompt","next_action_hint":"top_k=2 acceptance is identical to top_k=4 on this prompt (2.357), but draft/topk noise makes it slightly slower; try n_ctx=32k to see if reduced KV cache pressure helps target decode, or test top_k=4 on task761 to check cross-prompt generalization","rollback_reason":"9.90 TPS is below the kept top_k=4 best of 10.20 TPS; top_k=2 is not better on the benchmark prompt","note":"acceptance unchanged at 2.357, confirming that extra K=4 candidates do not improve acceptance on this prompt; draft time 149ms vs 144ms is within noise"}}
{"run":128,"commit":"ff511ad","metric":10.212288,"metrics":{"acceptance":2.357,"committed":33,"draft_ms":143.97,"e2e_tps":1.301236,"exact_ms":58.07,"gen_tokens":32,"pack_ms":1.09,"spec_sec":24.592,"step_ms":223.82,"steps":14,"topk_ms":20.66},"status":"discard","description":"exact path with n_ctx=32768 to test if reduced KV cache allocation improves TPS","timestamp":1777548345195,"segment":2,"confidence":13.614577179988123,"asi":{"hypothesis":"n_ctx=32768 reduces KV cache allocation overhead compared to 65536, potentially improving target decode speed","next_action_hint":"n_ctx has no meaningful effect on exact-path TPS; try draft GPU layers 5 or explore exact-validation batching/parallelization","note":"n_ctx=32k produced 10.21 TPS, essentially identical to 64k (10.20); KV cache pressure is not the bottleneck for this prompt length (20k tokens)","rollback_reason":"10.21 TPS is indistinguishable from 10.20 best; no improvement from halving n_ctx"}}
{"run":129,"commit":"ff511ad","metric":8.558163,"metrics":{"acceptance":2.429,"committed":34,"draft_ms":187.64,"e2e_tps":1.283028,"exact_ms":59.93,"gen_tokens":32,"pack_ms":1.1,"spec_sec":24.941,"step_ms":267.08,"steps":14,"topk_ms":18.36},"status":"discard","description":"exact path with draft GPU layers 5 — one layer off GPU hurts draft time significantly","timestamp":1777548448213,"segment":2,"confidence":5.987365455085925,"asi":{"hypothesis":"draft GPU layers 5 may reduce GPU memory contention or improve CPU-GPU balance","next_action_hint":"ngld6 is optimal for exact path; do not reduce draft offload further. Next explore exact-validation batching/parallelization or target decode call overhead reduction.","note":"draft_ms jumped to 187.64ms from ~144ms, step_ms to 267ms; moving draft layers off GPU hurts more than any acceptance gain","rollback_reason":"8.56 TPS is far below the 10.20 best; draft GPU offload must stay at 6 for exact path performance"}}
{"run":130,"commit":"974eb18","metric":9.884597,"metrics":{"acceptance":2.357,"committed":33,"draft_ms":150.8,"e2e_tps":1.298069,"exact_ms":58.39,"gen_tokens":32,"pack_ms":1.11,"spec_sec":24.652,"step_ms":231.24,"steps":14,"topk_ms":20.91},"status":"discard","description":"exact path with chain_seed=0 (pure best-first) and optimized params — chain seed still helps","timestamp":1777548855529,"segment":2,"confidence":7.771711676074962,"asi":{"hypothesis":"with top_k=4 and proposal_temp=0.7, pure best-first might produce a better tree than chain seed","next_action_hint":"chain seed remains beneficial; do not disable it. Next try gen=64 diagnostic or explore exact-validation batching code optimization.","note":"chain_seed=0 produced 9.88 TPS vs 10.20 with default chain seed; draft_ms=150.8 vs ~144ms; chain seed improves tree quality enough to offset any overhead","rollback_reason":"9.88 TPS below best; chain seed default is correct"}}
{"run":131,"commit":"974eb18","metric":9.720872,"metrics":{"acceptance":2.1,"committed":42,"draft_ms":143.17,"e2e_tps":1.631702,"exact_ms":51.79,"gen_tokens":42,"pack_ms":1.03,"spec_sec":25.74,"step_ms":216.03,"steps":20,"topk_ms":20},"status":"discard","description":"diagnostic run with gen=64 to check TPS over longer generation","timestamp":1777548960687,"segment":2,"confidence":7.844313356514611,"asi":{"hypothesis":"longer generation may reveal acceptance degradation or step time changes not visible in the 32-token benchmark","next_action_hint":"acceptance degrades from 2.36 to 2.10 over longer generation; draft/step time stays stable. Focus on per-step optimizations rather than prompt-length tuning.","note":"gen_tokens=42 (EOS at 42), steps=20, acceptance=2.10, step_ms=216ms; TPS=9.72 vs 10.2 for gen=32; draft model accuracy degrades with longer context, as expected"}}
{"run":132,"commit":"974eb18","metric":9.979978,"metrics":{"acceptance":2.357,"committed":33,"draft_ms":148.91,"e2e_tps":1.293191,"exact_ms":58.56,"gen_tokens":32,"pack_ms":1.1,"spec_sec":24.745,"step_ms":229.03,"steps":14,"topk_ms":20.43},"status":"discard","description":"exact path with K=1 to test whether topk_ms is CPU-bound or sync-bound","timestamp":1777549060523,"segment":2,"confidence":8.220960821503416,"asi":{"hypothesis":"K=1 argmax should be much faster than K=4 logsumexp+heap if CPU computation dominates topk_ms","next_action_hint":"topk_ms is dominated by GPU sync/wait, not CPU computation (K=1=20.4ms vs K=4=20.9ms). Do not optimize CPU top-k further. Focus on draft decode speed or exact-validation batching.","note":"K=1 topk_ms=20.43ms, K=4 topk_ms=20.92ms — difference is only 0.5ms. The ~20ms is mostly GPU synchronization tail from draft decode. Total draft+topk is ~169ms regardless of K.","rollback_reason":"K=1 does not improve topk_ms meaningfully; TPS=9.98 below best of 10.20"}}
{"run":133,"commit":"974eb18","metric":9.720387,"metrics":{"acceptance":2.267,"committed":34,"draft_ms":149.93,"e2e_tps":1.29728,"exact_ms":55.65,"gen_tokens":32,"pack_ms":1.08,"spec_sec":24.667,"step_ms":219.47,"steps":15,"topk_ms":12.79},"status":"discard","description":"exact path with block_size=8 override — draft time unchanged, acceptance drops","timestamp":1777549316541,"segment":2,"confidence":8.160393835091734,"asi":{"hypothesis":"reducing block_size from 16 to 8 should halve draft compute if draft time scales with tokens","next_action_hint":"draft time is NOT proportional to block_size; the SSM tree kernel likely has fixed overhead per step. Revert block_size override and try other optimizations.","note":"draft_ms=149.93 with block_size=8 vs ~144ms with block_size=16 — essentially the same. Acceptance dropped to 2.267 (from 2.357) because shallower tree has fewer candidate paths.","rollback_reason":"block_size=8 hurts acceptance without improving draft speed; not a useful optimization"}}
{"run":134,"commit":"974eb18","metric":10.074996,"metrics":{"acceptance":2.357,"committed":33,"draft_ms":148.2,"e2e_tps":1.297859,"exact_ms":58.21,"gen_tokens":32,"pack_ms":1.09,"spec_sec":24.656,"step_ms":226.87,"steps":14,"topk_ms":19.34},"status":"discard","description":"exact path with KV type q8_0 — similar performance to q4_0","timestamp":1777549692319,"segment":2,"confidence":8.417775842329654,"asi":{"hypothesis":"q8_0 KV cache may improve cache locality or reduce dequantization overhead vs q4_0","next_action_hint":"KV cache type has no meaningful effect on TPS; try other optimizations like target GPU layers or draft model quantization","note":"q8_0 produced 10.07 TPS, essentially identical to q4_0 (10.20); correctness passes; KV type is not a bottleneck","rollback_reason":"no improvement over q4_0 baseline"}}
{"run":135,"commit":"b4033f4","metric":10.364171,"metrics":{"acceptance":2.357,"committed":33,"draft_ms":142.29,"e2e_tps":1.309329,"exact_ms":57.78,"gen_tokens":32,"pack_ms":1.1,"spec_sec":24.44,"step_ms":220.54,"steps":14,"topk_ms":19.33},"status":"keep","description":"exact path with target GPU layers 80 — potential improvement over 65","timestamp":1777549798463,"segment":2,"confidence":9.583840128587989,"asi":{"hypothesis":"increasing target GPU layers from 65 to 80 may offload remaining CPU layers and improve target decode speed","next_action_hint":"repeat with n_gpu_layers=80 to confirm stability, and test n_gpu_layers=99 to check for further gains","note":"TPS=10.36, draft_ms=142.29, step_ms=220.54 — slightly better than n_gpu_layers=65 best of 10.20; could be noise or real improvement from better GPU utilization"}}
{"run":136,"commit":"b4033f4","metric":10.053725,"metrics":{"acceptance":2.357,"committed":33,"draft_ms":147.13,"e2e_tps":1.302189,"exact_ms":58.7,"gen_tokens":32,"pack_ms":1.09,"spec_sec":24.574,"step_ms":227.35,"steps":14,"topk_ms":20.39},"status":"discard","description":"exact path with target GPU layers 99 — worse than 80, possibly noise or memory contention","timestamp":1777549879409,"segment":2,"confidence":10.317799492058029,"asi":{"hypothesis":"n_gpu_layers=99 may fully offload all layers, potentially improving over 80","next_action_hint":"n_gpu_layers=80 appears best among tested values; repeat n_gpu_layers=80 for stability","rollback_reason":"10.05 TPS below n_gpu_layers=80 best of 10.36; 99 may cause memory fragmentation or is within noise","note":"step_ms=227.35, draft_ms=147.13 at n_gpu_layers=99 vs step_ms=220.54, draft_ms=142.29 at n_gpu_layers=80"}}
{"run":137,"commit":"b4033f4","metric":9.495718,"metrics":{"acceptance":2.357,"committed":33,"draft_ms":159.25,"e2e_tps":1.288297,"exact_ms":58.13,"gen_tokens":32,"pack_ms":1.11,"spec_sec":24.839,"step_ms":240.71,"steps":14,"topk_ms":22.19},"status":"discard","description":"repeat n_gpu_layers=80 to check stability — regressed to 9.50 TPS, confirming first run was noise","timestamp":1777549973455,"segment":2,"confidence":9.583840128587989,"asi":{"hypothesis":"repeat n_gpu_layers=80 to confirm the 10.36 TPS improvement was stable","next_action_hint":"n_gpu_layers parameter does not meaningfully affect TPS; the 10.36 run was noise. Return to exploring exact-validation batching or other code optimizations.","note":"repeat draft_ms=159.25, step_ms=240.71, TPS=9.50 — much worse than first run; GPU thermal/scheduling noise dominates small parameter changes","rollback_reason":"9.50 TPS well below best; n_gpu_layers=80 is not a real improvement"}}
{"run":138,"commit":"974eb18","metric":0,"metrics":{"acceptance":0,"committed":0,"draft_ms":0,"e2e_tps":0,"exact_ms":0,"gen_tokens":0,"pack_ms":0,"spec_sec":0,"step_ms":0,"steps":0,"topk_ms":0},"status":"crash","description":"exact path with no flash attention — fails because q4_0 KV cache requires flash_attn","timestamp":1777550079676,"segment":2,"confidence":9.583840128587989,"asi":{"hypothesis":"disabling flash attention might reduce overhead for small batch decodes","next_action_hint":"flash attention is required for this config; do not test without it","rollback_reason":"V cache quantization requires flash_attn; cannot disable flash attention with q4_0 KV cache"}}
{"run":139,"commit":"974eb18","metric":9.686461,"metrics":{"acceptance":2.429,"committed":34,"draft_ms":154.37,"e2e_tps":1.301607,"exact_ms":59.7,"gen_tokens":32,"pack_ms":1.14,"spec_sec":24.585,"step_ms":235.97,"steps":14,"topk_ms":20.73},"status":"discard","description":"exact path with draft_n_ctx capped to 512 — works correctly but slightly slower","timestamp":1777550273300,"segment":2,"confidence":8.417775842329654,"asi":{"hypothesis":"reducing draft_n_ctx from 4096 to 512 may reduce memory pressure and improve draft speed","next_action_hint":"draft_n_ctx can be as low as 512 without breaking correctness, but does not improve TPS. Revert and focus on other optimizations.","note":"draft_n_ctx=512 passed correctness but draft_ms=154.37 vs ~144ms baseline; no speedup","rollback_reason":"9.69 TPS below 10.20 best; draft_n_ctx reduction does not improve performance"}}
{"run":140,"commit":"974eb18","metric":9.452913,"metrics":{"acceptance":2.357,"committed":33,"draft_ms":160.47,"e2e_tps":1.286225,"exact_ms":58.18,"gen_tokens":32,"pack_ms":1.09,"spec_sec":24.879,"step_ms":241.8,"steps":14,"topk_ms":22.02},"status":"discard","description":"exact path with block_size=4 — draft time increases, not helpful","timestamp":1777550372252,"segment":2,"confidence":8.160393835091734,"asi":{"hypothesis":"block_size=4 should reduce draft compute if proportional to tokens","next_action_hint":"draft time has fixed floor around 140-160ms regardless of block_size; do not change block_size","note":"block_size=4 draft_ms=160.47 vs ~144ms at 16; acceptance unchanged at 2.357","rollback_reason":"worse TPS and higher draft time"}}
{"run":141,"commit":"974eb18","metric":9.433795,"metrics":{"acceptance":2.429,"committed":34,"draft_ms":158.73,"e2e_tps":1.286691,"exact_ms":60.06,"gen_tokens":32,"pack_ms":1.38,"spec_sec":24.87,"step_ms":242.29,"steps":14,"topk_ms":22.09},"status":"discard","description":"exact path with target_feat_ctx=160 — slightly higher acceptance but much higher draft time","timestamp":1777550473024,"segment":2,"confidence":7.918284287167812,"asi":{"hypothesis":"larger target feature window 160 may improve draft model accuracy","next_action_hint":"target_feat_ctx=128 remains the sweet spot; 160 increases draft time more than acceptance gain","note":"acceptance=2.429 vs 2.357 but draft_ms=158.73 vs ~144ms; net TPS worse","rollback_reason":"9.43 TPS below 10.20 best"}}
{"run":142,"commit":"b4033f4","metric":10.018032,"metrics":{"acceptance":2.357,"committed":33,"draft_ms":148.43,"e2e_tps":1.257664,"exact_ms":57.94,"gen_tokens":32,"pack_ms":1.1,"spec_sec":25.444,"step_ms":228.16,"steps":14,"topk_ms":20.66},"status":"discard","description":"exact path with actual top_k=4 — same as K=8 on this prompt","timestamp":1777550692217,"segment":2,"confidence":8.160393835091734,"asi":{"hypothesis":"actual top_k=4 may reduce topk overhead while maintaining acceptance","next_action_hint":"K=4 acceptance identical to K=8; test K=2 to find the lower bound","note":"actual K=4 produces same acceptance (2.357) and similar timing to K=8; extra candidates 5-8 are unused on this prompt"}}
